fecha_actualizacion,titulo,bop,enlace_bop,plazas_turno_libre,plazas_reservadas_minusvalidos,plazo_presentacion_solicitudes,url,otros_datos,bases,impresos,ORGANO_CONVOCANTE
1509090461,Convocatoria para la configuración de una lista de reserva de GRADUADO/A SOCIAL, grupo A, Subgrupo A2, para el nombramiento como funcionario/as interinos/as,93, de fecha 4 de agosto de 2017,http://www.bopsantacruzdetenerife.org/2017/08/093/,0,0,desde el día 5 de agosto hasta el día 24 de agosto de 2017, ambos inclusive,https://www.sctfe.es/empleo-publico/oposiciones-en-curso/,27/10/2017.&nbsp;Lista provisional de aspirantes admitidos y excluidos y plazo de subsanación [<a href="https://sede.santacruzdetenerife.es/fileadmin/user_upload/Oposiciones/graduado_social_2017/20171027_ANUNCIOP_GRADUADOSOCIAL.pdf" title="descargar" target="_blank" class="download">descargar</a>.pdf]<br />30/08/2017. Anuncio&nbsp;de Rectificación de error material advertido en el Anexo II de las Bases que han de regir la convocatoria [<a href="https://sede.santacruzdetenerife.es/fileadmin/user_upload/Oposiciones/graduado_social_2017/20170830_RMB_GRADUADO.pdf" title="descargar" target="_blank">descargar</a>.pdf]<br />Publicación BOP <a href="http://www.bopsantacruzdetenerife.org/2017/08/104/" target="_blank" title="ir a.." external="1">nº104/2017</a>, de 30 de agosto.&nbsp;,https://www.sctfe.es/uploads/tx_gbstfeoposiciones/20170807_BASES_graduadosocial.pdf,https://www.sctfe.es/uploads/tx_gbstfeoposiciones/20170807_INSTANCIA_ANEXO_graduadosocial.pdf.pdf,Ayuntamiento de Santa Cruz de Tenerife
1508839787,Convocatoria para provisión mediante funcionarios/as de carrera de 20 plazas de Policía, por el turno de acceso libre y mediante el sistema oposición,41/2015 de 30/03/2015,http://www.bopsantacruzdetenerife.org/2015/03/041/,20,0,día 16 de junio hasta el día 6 de julio, ambos inclusive,https://www.sctfe.es/empleo-publico/oposiciones-en-curso/,24/10/2017.&nbsp;Anuncio relativo a las<b> calificaciones del periodo de prácticas</b> y propuesta de <b>nombramiento</b> como funcionarios de carrera [<a target="_blank" href="https://sede.santacruzdetenerife.es/fileadmin/user_upload/Oposiciones/Policia2015/20171024_ANUNCIOCAL_POL.pdf" class="download" title="descargar">descargar</a>.pdf]<br />05/04/2017. <strong>Rectificación</strong> del anuncio relativo a las calificaciones del curso selectivo impartido por la Comunidad Autónoma de Canarias&nbsp; [<a target="_blank" href="https://sede.santacruzdetenerife.es/fileadmin/user_upload/Oposiciones/Policia2015/20170405_ANU_Calificaciones_Corregido_Curso_Selectivo_20_policias.pdf" class="download" title="descargar">descargar</a>.pdf]<br />05/04/2017. Anuncio relativo a las calificaciones del curso selectivo impartido por la Comunidad Autónoma de Canarias&nbsp; [<a target="_blank" href="https://sede.santacruzdetenerife.es/fileadmin/user_upload/Oposiciones/Policia2015/20170405_ANU_Calificaciones_Curso_Selectivo_20_policias.pdf" class="download" title="descargar">descargar</a>.pdf]<br />03/04/2017.&nbsp;Designación nominal de la Comisión Evaluadora del periodo de prácticas &nbsp;[<a target="_blank" href="https://sede.santacruzdetenerife.es/fileadmin/user_upload/Oposiciones/Policia2015/20170403_ANU_Comision_Evaluadora_20_policias.pdf" class="download" title="descargar">descargar</a>.pdf]<br />21/11/2016. Anuncio para emplazamientos en el Recurso Contencioso Administrativo P.A. 258/2016 &nbsp;[<a external="1" href="https://sede.santacruzdetenerife.es/fileadmin/user_upload/Oposiciones/Policia2015/20161121_ANU_Emplazamiento_20_Plazas_Policia_PA258_2016.pdf" title="Opens external link in new window">descargar</a>.pdf]<br />08/09/2016.&nbsp;Anuncio relativo a la ratificación de las calificaciones de la prueba de idioma y propuesta de nombramiento como funcionarios en prácticas &nbsp;[<a target="_blank" href="https://sede.santacruzdetenerife.es/fileadmin/user_upload/Oposiciones/Policia2015/20160908_ANU_Ratificacion_Idioma_Nombramiento.pdf" title="descargar">descargar</a>.pdf]<br />16/08/2016. Anuncio Calificaciones prueba de idiomas&nbsp;&nbsp;[<a target="_blank" href="https://sede.santacruzdetenerife.es/fileadmin/user_upload/Oposiciones/Policia2015/20160816_CAL_POL_.pdf" title="descargar">descargar</a>.pdf]<br />12/08/2016.&nbsp;Anuncio designación de asesores de la prueba de idioma y reconocimiento médico &nbsp;[<a target="_blank" href="https://sede.santacruzdetenerife.es/fileadmin/user_upload/Oposiciones/Policia2015/20160812_ANU_Designacion_Asesores_20_policias.pdf" title="descargar">descargar</a>.pdf]<br />10/08/2016. Anuncio lugar y fecha de la prueba de idiomas y reconocimiento médico&nbsp;[<a target="_blank" href="https://sede.santacruzdetenerife.es/fileadmin/user_upload/Oposiciones/Policia2015/20161008_PRUEBAIDIOMA_POL.pdf" title="descargar">descargar</a>.pdf]<br />08/08/2016. Anuncio de Ratificación&nbsp;de las calificaciones tercer ejercicio prueba de conocimiento (supuestos prácticos)&nbsp;&nbsp;[<a target="_blank" href="https://sede.santacruzdetenerife.es/fileadmin/user_upload/Oposiciones/Policia2015/20160808_CALIFICACIONES_POL.pdf" title="descargar">descargar</a>.pdf]<br />29/07/2016. Anuncio de las calificaciones tercer ejercicio prueba de conocimiento (supuestos prácticos)&nbsp;&nbsp;[<a target="_blank" href="https://sede.santacruzdetenerife.es/fileadmin/user_upload/Oposiciones/Policia2015/20160729_CALIFICACIONES2_pol_.pdf" title="descargar">descargar</a>.pdf]<br />01/07/2016. Anuncio ratificación de las calificaciones segundo ejercicio prueba de conocimiento (ejercicio de desarrollo) y calificaciones medias&nbsp; [<a target="_blank" href="https://sede.santacruzdetenerife.es/fileadmin/user_upload/Oposiciones/Policia2015/20160701_ANU_Ratificacion_Calificaciones.pdf" title="descargar">descargar</a>.pdf]<br />23/06/2016.&nbsp;Anuncio calificaciones segundo ejercicio prueba de conocimiento (ejercicio de desarrollo) [<a target="_blank" href="https://sede.santacruzdetenerife.es/fileadmin/user_upload/Oposiciones/Policia2015/20160623_Notas2aConoPol.pdf" title="descargar">descargar</a>.pdf]<p></p><p>15/06/2016.&nbsp;Ampliación del número de plazas previstas en la convocatoria [<a target="_blank" href="https://sede.santacruzdetenerife.es/fileadmin/user_upload/Oposiciones/Policia2015/20160615_ANU_Ampli_Plazas_20_Policias.pdf" title="descargar">descargar</a>.pdf]<br />28/04/2016.&nbsp;Desarrollo y criterios de baremación [<a target="_blank" href="https://sede.santacruzdetenerife.es/fileadmin/user_upload/Oposiciones/Policia2015/20160428_ANU_Baremacion_20_Plaza_Policia.pdf" title="descargar">descargar</a>.pdf]<br />20/04/2016. Calificaciones finales y fecha del ejercicio de desarrollo&nbsp;[<a target="_blank" href="https://sede.santacruzdetenerife.es/fileadmin/user_upload/Oposiciones/Policia2015/20042016_ANUNCIO_calfinales.pdf" title="descargar">descargar</a>.pdf]<br />12/04/2016.&nbsp;Anuncio de rectificación de las calificaciones primer ejercicio prueba de conocimiento (ejercicio tipo test)&nbsp;&nbsp;[<a target="_blank" href="https://sede.santacruzdetenerife.es/fileadmin/user_upload/Oposiciones/Policia2015/20160412_ANU_RECTIFICACION_CALIFICACIONES_EJERCICIO_TIPO_TEST.pdf" title="descargar">descargar</a>.pdf]<br />06/04/2016. Calificaciones primer ejercicio prueba de conocimiento (ejercicio tipo test) &nbsp;[<a target="_blank" href="https://sede.santacruzdetenerife.es/fileadmin/user_upload/Oposiciones/Policia2015/20160406_Calificaciones_ejercicio_tipo_test.pdf" title="descargar">descargar</a>.pdf]<br />04/04/2016.&nbsp;Anuncio rectificación&nbsp;respuestas correctas del ejercicio tipo test de la prueba de conocimiento (Modelos A&nbsp;y B) &nbsp;[<a target="_blank" href="https://sede.santacruzdetenerife.es/fileadmin/user_upload/Oposiciones/Policia2015/20160404_Test__A_corregido.pdf" title="descargar">test A</a>.pdf] &nbsp; [<a target="_blank" href="https://sede.santacruzdetenerife.es/fileadmin/user_upload/Oposiciones/Policia2015/20160404_Test__B_corregido.pdf" title="descargar">test B</a>.pdf]<br />04/04/2016.&nbsp;Rectificación de errores detectados en las respuestas correctas del ejercicio tipo test (Modelos A y B) &nbsp;[<a target="_blank" href="https://sede.santacruzdetenerife.es/fileadmin/user_upload/Oposiciones/Policia2015/20160404_ANU_Rectificaion_errores_respuestas_test..pdf" title="descargar">descargar</a>.pdf]</p><p>04/04/2016. Anuncio respuestas correctas del ejercicio tipo test de la prueba de conocimiento (Modelos A&nbsp;y B) &nbsp;[<a target="_blank" href="https://sede.santacruzdetenerife.es/fileadmin/user_upload/Oposiciones/Policia2015/20160404_TEST_A_Respuestas_20_Policias.pdf" title="descargar">test A</a>.pdf] &nbsp; [<a target="_blank" href="https://sede.santacruzdetenerife.es/fileadmin/user_upload/Oposiciones/Policia2015/20160404_TEST_B_Respuestas_20_Policias.pdf" title="descargar">test B</a>.pdf]</p><p>17/03/2016. Secretaría titular [<a target="_blank" href="https://sede.santacruzdetenerife.es/fileadmin/user_upload/Oposiciones/Policia2015/20160317_ANU_Secretaria_Titular_20_Policias.pdf" title="descargar">descargar</a>.pdf]<br />04/02/2016.&nbsp;Anuncio calificaciones finales y fijación de fecha y hora próximo ejercicio &nbsp;[<a target="_blank" href="https://sede.santacruzdetenerife.es/fileadmin/user_upload/Oposiciones/Policia2015/20160204_ANU_Calificaciones_finales_fecha_proximo_ejercicio.pdf" title="descargar">descargar</a>.pdf]</p><p>29/01/2016. Calificaciones&nbsp;segundo ejercicio de la Prueba Psicotécnica &nbsp;[<a target="_blank" href="https://sede.santacruzdetenerife.es/fileadmin/user_upload/Oposiciones/Policia2015/20160129_Calificaciones__2_Ejercicio_Prueba.pdf" title="descargar">descargar</a>.pdf]<br />26/01/2016. Emplazamiento reclamación en relación a las calificaciones del primer ejercicio de la Prueba&nbsp;Psicotécnica &nbsp;[<a target="_blank" href="https://sede.santacruzdetenerife.es/fileadmin/user_upload/Oposiciones/Policia2015/20160126_ANU_Emplazamiento_Reclamaciones_20_Policias.pdf" title="descargar">descargar</a>.pdf]<br />22/01/2016. Calificaciones &nbsp;[<a target="_blank" href="https://sede.santacruzdetenerife.es/fileadmin/user_upload/Oposiciones/Policia2015/20160122_ANU_Calificaciones.pdf" title="descargar">descargar</a>.pdf]<br />19/01/2016.&nbsp;Designación nominal de la Secretaria Suplente del Tribunal Calificador&nbsp;[<a target="_blank" href="https://sede.santacruzdetenerife.es/fileadmin/user_upload/Oposiciones/Policia2015/19012016_SECRETARIA_SUPLENTE_POL.pdf" title="ir al anuncio">anuncio</a><a target="_blank" href="https://sede.santacruzdetenerife.es/fileadmin/user_upload/Oposiciones/Policia2015/15122015_NOTAS4_policia.pdf" title="descargar">.</a>pdf]</p><p>23/12/2015</p><ul><li>Anuncio&nbsp;de la fecha, hora y lugar de celebración del inicio de la Prueba Psicotécnica&nbsp;[<a target="_blank" href="https://sede.santacruzdetenerife.es/fileadmin/user_upload/Oposiciones/Policia2015/23122015_examenpsic_pol.pdf" title="ir al anuncio">anuncio</a><a target="_blank" href="https://sede.santacruzdetenerife.es/fileadmin/user_upload/Oposiciones/Policia2015/15122015_NOTAS4_policia.pdf" title="descargar">.</a>pdf] <a external="1" target="_blank" href="https://sede.santacruzdetenerife.es/edictos/edicto/articulo/-4b9dd1545a/" title="ir a..">ver edicto</a></li><li>Designación de asesores especialistas para la&nbsp;Prueba Psicotécnica[<a target="_blank" href="https://sede.santacruzdetenerife.es/fileadmin/user_upload/Oposiciones/Policia2015/23122015_ASESORESPSICOT_pol.pdf" title="descargar">descargar.</a>pdf]</li></ul>15/12/2015.Calificaciones de la Prueba de Aptitud Física consistente en Adaptación al Medio Acuático (50 m estilo libre) [<a target="_blank" href="https://sede.santacruzdetenerife.es/fileadmin/user_upload/Oposiciones/Policia2015/15122015_NOTAS4_policia.pdf" title="descargar">descargar.</a>pdf]<br />11/12/2015.&nbsp;Anuncio compresivo de la&nbsp;resolución de las reclamaciones formuladas, así como de las calificaciones ratificadas en relación a la Prueba de Aptitud Física consistente en Resistencia Aeróbica (Test de Cooper)&nbsp;[<a target="_blank" href="https://sede.santacruzdetenerife.es/fileadmin/user_upload/Oposiciones/Policia2015/20151211_ANUNCIO_pol.pdf" title="descargar">descargar</a>.pdf]<br />09/12/2015. Anuncio informativo relativo a la Prueba de Aptitud Física consistente en la Adaptación al Medio Acuático (50 m estilo libre) &nbsp;[<a target="_blank" href="https://sede.santacruzdetenerife.es/fileadmin/user_upload/Oposiciones/Policia2015/20151209_ANU_Prueba_piscina.pdf" title="descargar">descargar</a>.pdf]<br />03/12/2015. Anuncio comprensivo de la resolución de reclamación presentada, de las calificaciones de la Prueba de Aptitud Física consistente en Resistencia Aeróbica (Test de Cooper) del proceso selectivo para la cobertura mediante funcionarios/as de carrera de veinte plazas de Policía del Cuerpo de la Policía Local, por el turno de acceso libre y mediante el sistema de oposición, así como de la fecha, hora y lugar de celebración del cuarto Ejercicio de la Prueba de Aptitud Física[<a target="_blank" href="https://sede.santacruzdetenerife.es/fileadmin/user_upload/Oposiciones/Policia2015/03122015_ANUNCIO_4Ejercicio.pdf" title="descargar">descargar</a>.pdf] [<a external="1" target="_blank" href="https://sede.santacruzdetenerife.es/edictos/edicto/articulo/-bfd26a05fc/" title="ir a..">ver edicto</a>]<br />30/11/2015. Anuncio comprensivo de la resolución de las reclamaciones formuladas, así como de las calificaciones ratificadas en relación a la Prueba de Aptitud Física&nbsp;[<a target="_blank" href="https://sede.santacruzdetenerife.es/fileadmin/user_upload/Oposiciones/Policia2015/20151130_calificaciones_2ejercioPol.pdf" title="descargar">descargar</a>.pdf]<br />24/11/2015.&nbsp;Calificaciones de la&nbsp;Prueba de Aptitud Física Flexiones de brazos&nbsp;y&nbsp;fecha,hora y lugar de celebración del tercer ejercicio de la Prueba de Aptitud Física&nbsp;[<a target="_blank" href="https://sede.santacruzdetenerife.es/fileadmin/user_upload/Oposiciones/Policia2015/24112015_CALIFICACIONES_2FISICA.pdf" title="descargar">descargar</a>.pdf]<br />20/11/2015.&nbsp;Resolución reclamaciones formuladas, así como de las calificaciones ratificadas en relación a la Prueba de Aptitud Física consistente en el Salto Horizontal &nbsp;[<a target="_blank" href="https://sede.santacruzdetenerife.es/fileadmin/user_upload/Oposiciones/Policia2015/20151120_ANU_Reclamaciones_Calificaciones_prueba_salto_20_Policias.pdf" title="descargar">descargar</a>.pdf]<br />16/11/2015. Anuncio de calificaciones de la prueba de salto horizontal&nbsp;y&nbsp;fecha y lugar&nbsp;celebración del inicio del segundo&nbsp;ejercicio&nbsp;[<a target="_blank" href="https://sede.santacruzdetenerife.es/fileadmin/user_upload/Oposiciones/Policia2015/20151116_AnuncioCALpruebasal_vto.pdf" title="descargar">descargar</a>.pdf]<br />11/11/2015. Nota informativa sucesión pruebas &nbsp;[<a target="_blank" href="https://sede.santacruzdetenerife.es/fileadmin/user_upload/Oposiciones/Policia2015/20151112_NOTA_INFORMATIVA_Sucesion_pruebas.pdf" title="descargar">descargar</a>.pdf]<br />11/11/2015.&nbsp;Designación asesores especialistas para la primera prueba de la fase de oposición (aptitud física) &nbsp;[<a target="_blank" href="https://sede.santacruzdetenerife.es/fileadmin/user_upload/Oposiciones/Policia2015/20151111_ANUN_Asesores_Prueba__20_Policias.pdf" title="descargar">descargar</a>.pdf]<br />11/11/2015.&nbsp;Designación asesora especialista para la primera prueba de la fase de oposición (aptitud física) &nbsp; [<a target="_blank" href="https://sede.santacruzdetenerife.es/fileadmin/user_upload/Oposiciones/Policia2015/20151111_ANU_ASESORA_20_POLICIAS.pdf" title="descargar">descargar</a>.pdf]<br />04/11/2015.&nbsp;Anuncio recordatorio&nbsp;para la realización de las pruebas de aptitud física [<a target="_blank" href="https://sede.santacruzdetenerife.es/fileadmin/user_upload/Oposiciones/Policia2015/20151104_ANUNCIO_dnipol.pdf" title="Descargar">anuncio</a>.pdf]<br />20/10/2015.&nbsp;Anuncio relativo a rectificación error material en decreto de fecha 15 de octubre de 2015, por el que se aprueba la lista definitiva de aspirantes admitidos/as y excluidos/as&nbsp;&nbsp;[<a target="_blank" href="https://sede.santacruzdetenerife.es/fileadmin/user_upload/Oposiciones/Policia2015/20151020_ANREC_policia.pdf" title="descargar">descargar</a>.pdf]<br />19/10/2015. Composicion nominal del tribunal calificador &nbsp;[<a target="_blank" href="https://sede.santacruzdetenerife.es/fileadmin/user_upload/Oposiciones/Policia2015/20151019_ANU_DesignacionNominal_Policia.pdf" title="descargar">descargar</a>.pdf]<br />16/10/2015.&nbsp;Lista definitiva de admitidos y excluidos y fecha y lugar&nbsp;celebración del inicio del primer ejercicio&nbsp;&nbsp;[<a target="_blank" href="https://sede.santacruzdetenerife.es/fileadmin/user_upload/Oposiciones/Policia2015/20151016_LISTADEL_POLICIA.pdf" title="descargar">descargar</a>.pdf]<br />08/09/2015.&nbsp;Modificación Bases BOP 113/15 &nbsp;[<a target="_blank" href="https://sede.santacruzdetenerife.es/fileadmin/user_upload/Oposiciones/Policia2015/20150809_Modificacion_Bases_Bop113_15.pdf" title="descargar">descargar</a>.pdf]<br />14/08/2015.&nbsp;Anuncio relativo a la aprobación de la lista provisional de admitidos/as y excluidos/as&nbsp;&nbsp;[<a target="_blank" href="https://sede.santacruzdetenerife.es/fileadmin/user_upload/Oposiciones/Policia2015/20150814_anuncioListas_policia.pdf" title="descargar">descargar</a>.pdf]&nbsp;<br />25/06/2015&nbsp;Declaración de permiso de conducción&nbsp;[<a target="_blank" href="https://sede.santacruzdetenerife.es/fileadmin/user_upload/Oposiciones/Policia2015/DECLARACIONPCONDUC_.pdf" title="descargar">descargar</a>.pdf]<br />18/06/2015 <ul><li>Publicación Bases (B.O.P nº <a target="_blank" href="https://sede.santacruzdetenerife.es/fileadmin/user_upload/Oposiciones/Policia2015/BasesBOPPol.pdf" title="ir a..">41/2015</a> de 30 de marzo)</li><li>Declaración Responsable sobre rentas &nbsp;[<a target="_blank" href="https://sede.santacruzdetenerife.es/fileadmin/user_upload/Oposiciones/Policia2015/20150615_DJRENTAS_POLICIAS2015.pdf" title="descargar">descargar</a>.pdf]</li><li>Declaración Responsable Base Segunda [<a target="_blank" href="https://sede.santacruzdetenerife.es/fileadmin/user_upload/Oposiciones/Policia2015/20150615_DJbase2_POLICIAS2015.pdf" title="descargar">descargar</a>.pdf]</li></ul>,https://www.sctfe.es/uploads/tx_gbstfeoposiciones/20150615_ANUNCIO_AB_POLICIAS2015.pdf,https://www.sctfe.es/uploads/tx_gbstfeoposiciones/20150615_INSTANCIA_POLICIAS2015.pdf,Ayuntamiento de Santa Cruz de Tenerife
1507116214,Convocatoria para configuración de una Lista de Reserva de Técnico/a de Administración General, para el nombramiento como funcionarios/as interinos/as,,,0,0,,https://www.sctfe.es/empleo-publico/oposiciones-en-curso/,<b>04/10/2017.</b> Anuncio aprobación lista reserva&nbsp; [<a title="descargar" class="download" target="_blank" href="https://sede.santacruzdetenerife.es/fileadmin/user_upload/Oposiciones/2017_Lista_Reserva_TAG/20171004_LISTA_RESERVA_TAG.pdf">descargar</a>.pdf]<b><br />12/07/2017. </b>Ratificación de las calificaciones del 2º ejercicio de naturaleza práctica y calificaciones finales de la fase de oposición [<a title="descargar" class="download" href="https://sede.santacruzdetenerife.es/fileadmin/user_upload/Oposiciones/2017_Lista_Reserva_TAG/20170712_ANU_TAG.pdf" target="_blank">descargar</a>.pdf]<br /><b>03/07/2017. </b>Anuncio calificaciones ejercicio de naturaleza práctica [<a title="descargar" class="download" href="https://sede.santacruzdetenerife.es/fileadmin/user_upload/Oposiciones/2017_Lista_Reserva_TAG/20170703_CAL_TAG.pdf" target="_blank">descargar.</a>pdf]<br /><b>27/06/2017. </b>Ratificaciones de naturaleza teórica y<b>&nbsp;</b>fecha, hora y lugar de celebración del ejercicio de naturaleza práctica [<a title="descargar" class="download" href="https://sede.santacruzdetenerife.es/fileadmin/user_upload/Oposiciones/2017_Lista_Reserva_TAG/20170627_RATCAL_TAG.pdf" target="_blank">descargar</a>.pdf]<b><br />21/06/2017.</b>Calificaciones correspondientes al ejercicio de naturaleza teórica [<a title="descargar" href="https://sede.santacruzdetenerife.es/fileadmin/user_upload/Oposiciones/2017_Lista_Reserva_TAG/21062017_CALI_TAG_2017.pdf" target="_blank">descargar</a>.pdf]<b><br />05/05/2017. </b>Anuncio criterios bareamación definitivo&nbsp; [<a title="descargar" href="https://sede.santacruzdetenerife.es/fileadmin/user_upload/Oposiciones/2017_Lista_Reserva_TAG/20170505_ANU__Tribunal_Calificador_TAG_2017.pdf" target="_blank">descargar</a>.pdf]<b><br />04/05/2017.&nbsp;</b>Lista definitiva de aspirantes admitidos [<a title="descargar" href="https://sede.santacruzdetenerife.es/fileadmin/user_upload/Oposiciones/2017_Lista_Reserva_TAG/04052017_LISTADEF_TAG.pdf" target="_blank">descargar</a>.pdf]<b><br />27/04/2017. </b>Designación nominal del Tribunal Calificador<b>&nbsp; </b>[<a title="descargar" href="https://sede.santacruzdetenerife.es/fileadmin/user_upload/Oposiciones/2017_Lista_Reserva_TAG/20170427_ANU_TRIBUNAL_CALIFICADOR_TAG.pdf" target="_blank">descargar</a>.pdf]<b><br />03/04/2017. </b>Corrección error transcripción Bases &nbsp;[<a title="descargar" href="https://sede.santacruzdetenerife.es/fileadmin/user_upload/Oposiciones/2017_Lista_Reserva_TAG/20170403_ANU_Correccion_Error_Transcripcion_Bases_2017_TAG.pdf" target="_blank">descargar</a>.pdf]<br /><b>27/03/2017.&nbsp;</b>Lista provisional de aspirantes admitidos y excluídos &nbsp;[<a title="descargar" href="https://sede.santacruzdetenerife.es/fileadmin/user_upload/Oposiciones/2017_Lista_Reserva_TAG/20170327_ANU_Lista_proviosnal_Reserva_TAG_2017.pdf" target="_blank">descargar</a>.pdf] <ul><li>Bases &nbsp;&nbsp;[<a title="descargar" href="https://sede.santacruzdetenerife.es/fileadmin/user_upload/Oposiciones/2017_Lista_Reserva_TAG/BASES_TAG_2017.pdf" target="_blank">descargar</a>.pdf]</li><li>Modelo de instancia &nbsp;&nbsp;[<a title="descargar" href="https://sede.santacruzdetenerife.es/fileadmin/user_upload/Oposiciones/2017_Lista_Reserva_TAG/INST_TAG_2017.pdf" target="_blank">descargar</a>.pdf]</li><li>Declaración responsable sobre rentas&nbsp;&nbsp;[<a title="descargar" href="https://sede.santacruzdetenerife.es/fileadmin/user_upload/Oposiciones/2017_Lista_Reserva_TAG/DECLARACION_RESPONSABLE_TAG_2017.pdf" target="_blank">descargar</a>.pdf]</li><li>Plazo de presentación de instancias &nbsp;[<a title="descargar" href="https://sede.santacruzdetenerife.es/fileadmin/user_upload/Oposiciones/2017_Lista_Reserva_TAG/ANUNCIO_PLAZO_INSTANCIA_LISTA_RESERVA_TAG.pdf" target="_blank">descargar</a>.pdf]</li></ul>&nbsp;,,,Ayuntamiento de Santa Cruz de Tenerife
1506687078,Convocatoria para la provisión por personal laboral fijo de 5 plazas de Oficial de Vigilancia y Mantenimiento de Instalaciones Municipales. Una por el turno de acceso libre y cuatro por el turno de promoción interna y mediante el sistema de concurso oposición,,,0,0,21 de julio hasta el día 9 de agosto de 2017, ambos inclusive,https://www.sctfe.es/empleo-publico/oposiciones-en-curso/,29/09/2017. Plazo para subsanación&nbsp;  [<a title="descargar" class="download" target="_blank" href="https://sede.santacruzdetenerife.es/fileadmin/user_upload/Oposiciones/2017_Laboral_Vigilancia/20170929_ANU_PLAZO_SUBSANACION_Vigilante.pdf">descargar</a>.pdf]<br />29/09/2017. Lista provisional de admitidos/as y excluidos/as&nbsp; [<a title="descargar" class="download" target="_blank" href="https://sede.santacruzdetenerife.es/fileadmin/user_upload/Oposiciones/2017_Laboral_Vigilancia/20170929_ANU_LISTA_PROVISIONAL_vigilancia.pdf">descargar</a>.pdf]<ul><li><a href="https://sede.santacruzdetenerife.es/fileadmin/user_upload/Oposiciones/2017_Laboral_Vigilancia/20170720_BASES_Laborales_vigilancia.pdf" target="_blank" class="download" title="descargar">Bases</a>.pdf</li><li><a href="https://sede.santacruzdetenerife.es/fileadmin/user_upload/Oposiciones/2017_Laboral_Vigilancia/20170720_MODELO_INSTANCIAS_Laborales_vigilancia.pdf" target="_blank" class="download" title="descargar">Modelo de instancia</a>.pdf</li><li><a href="https://sede.santacruzdetenerife.es/fileadmin/user_upload/Oposiciones/2017_Laboral_Vigilancia/20170720_DECLARACION_RESPONSABLE_RENTAS_Laborales_vigilancia.pdf" target="_blank" class="download" title="descargar">Declaración responsable sobre rentas</a>.pdf</li><li><a href="https://sede.santacruzdetenerife.es/fileadmin/user_upload/Oposiciones/2017_Laboral_Vigilancia/20170720_MERITOS_Laborales_vigilancia.pdf" target="_blank" class="download" title="descargar">Documento presentación méritos</a>.pdf</li><li><a href="https://sede.santacruzdetenerife.es/fileadmin/user_upload/Oposiciones/2017_Laboral_Vigilancia/20170720_PLAZO_INSTANCIAS_Laborales_vigilancia.pdf" target="_blank" class="download" title="descargar">Plazo de presentación de instancias</a>.pdf</li></ul>,,,Ayuntamiento de Santa Cruz de Tenerife
