ID;ENTITAT;SECTORSEMANTIC1;SECTORSEMANTIC2;SECTORSEMANTIC3;SIGLA;CODI_CARRER;CARRER;NRO;BIS;ESCALA;PIS;PORTA;CODI_DIVISIO_TERRITORIAL_ADMINISTRATIVA;CODI_DIVISIO_TERRITORIAL;CODI_POSTAL;AMBIT;ANY_CONSTITUCIO;TELEFON;MAIL;WEB;UTMX;UTMY;LATITUD;LONGITUD;ADREÇA_COMPLETA
2;CENTRO ANDALUZ BLAS INFANTE DE CORNELLÀ;Culturals;;;;;;;;;;;D-07;B-07;08940;Indefinit;1984;933753853;blasinfante.cornella@hotmail.com;;;;;;GERDERA, S/N. Centre Civic Sant Ildefons
3;CLUB D AMICS DEL FERROCARRIL-CORNELLÀ;Culturals;;;;;;;;;;;D-02;B-01;08940;Indefinit;1978;933772575;trenscornella@cafc.e.telefonica.net;;;;;;AMADEU VIVES, S/N (Antiga Estacio FF.CC Riera)
4;AS. JUBILATS I PENS. FONTSANTA-FATJÓ;Gent gran;;;;;;;;;;;D-04;B-04;08940;Indefinit;1987;934741442;ajpfontsanta@live.com;;;;;;C.GANDESA 6
5;CLUB ESPORTIU CORNELLÀ;Esportives;;;;;;;;;;;D-05;B-06;08940;Indefinit;1968;936851764;pebol62@hotmail.com;www.c.e.cornella.net;;;;;AV LINEA ELECTRICA 1-7
6;CLUB NATACIO CORNELLA;Esportives;;;;;;;;;;;D-05;B-06;08940;Indefinit;1983;934742937;juntadirectiva@cncornella.cat;cncornella.cat;;;;;BONAVISTA, 70 Piscina Can Millars
7;ASSOCIACIÓ MIJAC ELS ESQUIROLS;Juvenils;;;;;;;;;;;D-03;B-03;08940;Indefinit;1979;;mariano_bayon@hotmail.com;;;;;;PGE. DOLORS ALMEDA, S/N Parroquia Sant Jaume
9;ASSOCIACIÓ DE MARES I PARES D ALUMNES DE L´ESCOLA L ARENY;Educació i formació;;;;;;;;;;;D-02;B-02;08940;Indefinit;1987;933776157;ampaslareny@hotmail.com  ;https://ampaareny.wordpress.com/;;;;;SANT LLUIS, S/N Col·legi L Areny
10;ASOCIACIÓN DE VECINOS LA MIRANDA DE CORNELLÁ;Veïnals;;;;;;;;;;;D-05;B-06;08940;Indefinit;1978;646244652;av-lamiranda@hotmail.com;;;;;;EMPORDÀ, S/N
14;CE.CULT. R. EXTREMEÑO LA SEGARRA DE C.;Culturals;;;;;;;;;;;D-07;B-07;08940;Indefinit;1987;933762640;info@ccrelasegarradecornella.com;ccrelasegarradecornella.com;;;;;SEGARRA, S/N .
15;AMICS DE LA SARDANA DE CORNELLA;Culturals;;;;;;;;;;;D-02;B-01;08940;Indefinit;1979;933774369;sayolvallhonrat@arrakis.es;;;;;;RUBIO I ORS, 232 BAIXOS
16;PEÑA BARCELONISTA FONTSANTA-FATJO;Esportives;;;;;;;;;;;D-01;B-04;08940;Indefinit;1986;933770981;penyabarcelonistafontsanta@gmail.com;;;;;;PLAÇA FONTSANTA Nº 10. BAIXOS.
19;ASSOCIACIO DE MARES I PARES D ALUMNES DEL CEIP SURIS;Educació i formació;;;;;;;;;;;D-04;B-04;08940;Indefinit;1983;933777457;ampasuris12@gmail.com;ampasuris.blogspot.com.es;;;;;TERRA ALTA, S/N 
20;CLUB BASKET ALMEDA;Esportives;;;;;;;;;;;D-03;B-03;08940;Indefinit;1971;933775577;info@basketalmeda.com;www.basketalmeda.com;;;;;SANT FERRAN, 45, BIS Pavelló Almeda
22;FRATERNITAT CRISTIANA DE MALALTS I MINUSVALITS;Suport social;;;;;;;;;;;D-02;B-05;08940;Indefinit;1962;934713344;ana.fer.ru@hotmail.com;;;;;;Feliu i Codina, 4
23;PATRONAT CULTURAL I RECREATIU;Culturals;;;;;;;;;;;D-02;B-01;08940;Indefinit;1910;933770229;info@pcr.cat;www.pcr.cat;;;;;MOSSÈN JACINT VERDAGUER NÚM. 52 (Patronat Cultural i Recreatiu)
24;ASOCIACION ORNITOLOGICA  LA CADERNERA  DE CORNELLÀ;Culturals;;;;;;;;;;;D-05;B-06;08940;Indefinit;1964;933761743;lacaderneradecornella@hotmail.com;;;;;;EMPORDÀ, S/N. (Local AA.VV. Miranda)
25;ASOC. CULT. GALEGA ROSALIA DE CASTRO;Culturals;;;;;;;;;;;D-02;B-06;08940;Indefinit;1980;933751103;acgrosaliadecastro@gmail.com;;;;;;FEDERICO SOLER, 71
26;ASSOCIACIÓ ESPORTIVA JUVENTUD RIERA CORNELLÀ;Esportives;;;;;;;;;;;D-02;B-02;08940;Indefinit;1982;;aejrieracornella@gmail.com;www.aejrieracornella.com;;;;;FRANCESC  MORAGUES, 3-9 Pavelló Riera
28;ASSOCIACIÓ DE VEÏNS FONTSANTA DEL BARRI FATJÓ DE CORNELLÀ DE LLOBREGAT;Veïnals;;;;;;;;;;;D-04;B-04;08940;Indefinit;1978;934741975;aavvff@hotmail.es;;;;;;PLZ. GANDESA, 1 BAIXOS.
29;ASSOCIACIÓ VEÏNAL DE SANT ILDEFONS.;Veïnals;;;;;;;;;;;D-04;B-07;08940;Indefinit;1965;934711441;avvsanildefonso@hotmail.com;www.santildefons.com;;;;;PJE.FEDERICO G.LORCA, S/N Darrera Col·legi Sant Ildefons
30;CD FONTSANTA;Esportives;;;;;;;;;;;D-04;B-04;08940;Indefinit;1982;934751145;cdfontsantafatjo@gmail.com;www.cdfontsantafatjo.org;;;;;CTRA. SANT JOAN DESPI, S/N Estadi de Futbol Fontsanta
32;CORNELLA ATLETIC;Esportives;;;;;;;;;;;D-02;B-02;08940;Indefinit;1965;934753524;cornellaatletic@hotmail.com;www.cornellaatletic.es;;;;;C/ DEL RUGBY S/N .CANTONADA AV. DEL BAIX LLOBREGAT, S/N (Nou Estadi Municipal)
33;PEÑA ATLETICO MINAS DE CORNELLA;Culturals;;;;;;;;;;;D-05;B-06;08940;Indefinit;1984;933755055;atleticominas1984@gmail.com;;;;;;BONAVISTA, NÚM. 4 - 6 BAIXOS
34;FUNDACIÓ UTOPIA JOAN N. GARCÍA-NIETO, ESTUDIS SOCIALS DEL BAIX LLOBREGAT;Culturals;;;;;;;;;;;D-03;B-01;08940;Indefinit;1990;934745135;utopia@aj-cornella.cat;www.fundacioutopia.org;;;;;MDEZ. PELAYO, S/N. Castell de Cornellà.
36;RUGBY CLUB CORNELLÀ;Esportives;;;;;;;;;;;D-02;B-01;08940;Indefinit;1931;660491756;administracio@rugbyclubcornella.cat;www.rugbyclubcornella.com;;;;;C/ RUGBY S/N
37;CORAL NOVA DE CORNELLA;Culturals;;;;;;;;;;;D-02;B-01;08940;Indefinit;1986;933778703;;;;;;;MOSSÈN JAUME RAFANELL S/N
40;ASSOCIACIO CORNELLÀ PER LES DONES-1994;Gènere;;;;;;;;;;;D-07;B-07;08940;Indefinit;1995;933756329;cornellaperlesdones@gmail.com;;;;;;GERDERA S/N ( CENTRE CÍVIC SANT ILDEFONS )
41;ASSOCIACIÓ PENYA MADRIDISTA FONTSANTA;Esportives;;;;;;;;;;;D-04;B-04;08940;Indefinit;1983;933779946;pmfontsanta@teleline.es;;;;;;PLAÇA FONTSANTA 10 BXOS
42;ASSOCIACIÓ DE PARES D ALUMNES COL.LEGI SAGRADA FAMÍLIA;Educació i formació;;;;;;;;;;;D-02;B-01;08940;Indefinit;1975;605548488;ampa.safa.cornella@gmail.com;sfamilia@planalfa.es;;;;;DR. CARULLA, 23 (Col·legi Sagrada Familia)
43;ASSOCIACIÓ DE MARES I PARES D´ALUMNES ESCOLA ELS PINS;Educació i formació;;;;;;;;;;;D-02;B-01;08940;Indefinit;1986;934742592;ampapinscornella@gmail.com;www.ampaelpinscornella.org;;;;;PIUS XIIè, S/N. Col·legi Els Pins
44;ASSOCIACIÓ DE MARES I PARES D´ALUMNES DE L´ESCOLA ANTONI GAUDÍ;Educació i formació;;;;;;;;;;;D-03;B-06;08940;Indefinit;1978;933774348;ampagaudicornella@gmail.com;http:\\ampagaudicornella.blogspot.com;;;;;Av.del Parc Can Mercader, 6
45;P.CULT. AND. Y FLAMENCO RECREATIVA LOS AFICIONAOS;Culturals;;;;;;;;;;;D-04;B-05;08940;Indefinit;1979;934710166;losaficionaos@hotmail.com;;;;;;SEVILLA, S/N Junto Pavelló Can Carbonell
46;HERMANDAD DE NUESTRA SEÑORA DEL ROCÍO DE CORNELLÁ DE LLOBREGAT;Culturals;;;;;;;;;;;D-04;B-05;08940;Indefinit;1981;934711466;secretaria@hermandadrociocornella.com;;;;;;JOSEP MASGRAU, 61, Baixos. D.
47;GRUP D ESPLAI VOL I VOL DE CORNELLÀ DE LLOBREGAT;Juvenils;;;;;;;;;;;D-02;B-01;08940;Indefinit;1987;933779766;esplaivolivol@gmail.com;www.esplaivolivol.org;;;;;PL. LLUIS COMPANYS, S/N. Mercat Centre 3ª Planta
48;UNIÓ EXCURSIONISTA DE CATALUNYA DE CORNELLA;Esportives;;;;;;;;;;;D-02;B-01;08940;Indefinit;1947;933773203;ueccornella@gmail.com;u-e-c-c.blogspot.com;;;;;EDIFICI PRECSA. 4º PLANTA.PARC DE CAN MERCADER. CTRA DE L´HOSPITALET S/N
49;ASSOC. DE PARES I.E.S. ESTEVE TERRADES;Educació i formació;;;;;;;;;;;D-03;B-06;08940;Indefinit;1976;933776854;ampa@iesesteveterradas.cat;;;;;;BONAVISTA, 70 I.E.S. Esteve Terrades
50;ELS DIABLES DE CORNELLA;Culturals;;;;;;;;;;;D-05;B-06;08940;Indefinit;1988;933772551;smontell@telefonica.net;;;;;;MIRANDA, 11-13, 2º 4ª
52;CORNELLART, TRAÇOS, ARTS PLASTIQUES, DIFUSIO;Culturals;;;;;;;;;;;D-07;B-07;08940;Indefinit;1986;933753853;mpila2020@yahoo.es;;;;;;GERDERA, S/N. Centre Cívic Sant Ildefons
53;ASOC. ANDALUZA HIJOS DE ALMÁCHAR;Culturals;;;;;;;;;;;D-05;B-06;08940;Indefinit;1978;933751254;asocalmachar@gmail.com;;;;;;FLORIDA, NÚM. 38, BAIXOS
54;CLUB DE VOLEIBOL DE CORNELLA;Esportives;;;;;;;;;;;D-06;B-07;08940;Indefinit;1984;629709528;spalbiac@yahoo.es;;;;;;AV. SANT ILDEFONS, 20, 14º 5ª
55;FAVCO - FEDERACIÓN DE ASOCIACIONES DE VECINOS DE CORNELLÁ;Veïnals;;;;;;;;;;;D-05;B-06;08940;Indefinit;1987;933765903;favcoo@hotmail.com;;;;;;HERMENEGILDO GOULA, NÚM. 3 - 5 BAIXOS. (Local AA.VV Gavarra)
56;CENTRE INFANTIL I JUVENIL MOWGLI;Juvenils;;;;;;;;;;;D-03;B-05;08940;Indefinit;1971;933770695;cijmowgli@fundesplai.org;;;;;;PLÇ. JOSEP TARRADELLAS, S/N
57;ASSOCIACIÓ DE VEÏNS DEL BARRI PADRÓ ;Veïnals;;;;;;;;;;;D-04;B-05;08940;Indefinit;1975;934710490;aavvpadro@gmail.com;;;;;;DOMENECH I MUNTANER, 25, LOCALS 1-4
58;C. D. ALMEDA;Esportives;;;;;;;;;;;D-03;B-03;08940;Indefinit;1970;935971445;cdalmedaef@gmail.com;;;;;;SILICI, S/N Camp de Fútbol d Almeda
59;CLUB BASQUETBOL CORNELLA;Esportives;;;;;;;;;;;D-02;B-01;08940;Indefinit;1929;934740282;secretaria.basquetcornella@gmail.com;www.basquetcornella.com;;;;;RUBIÓ I ORS, 158 Pavelló Centre
61;AJEDREZ CLUB PADRO;Esportives;;;;;;;;;;;D-04;B-05;08940;Indefinit;1947;;padavd@yahoo.es;;;;;;TORRAS I BAGES, 62 Local Orfeó Catalonia
62;SOCIEDAD DE OCELLAIRES CORNELLÀ DE LLOBREGAT;Esportives;;;;;;;;;;;D-05;B-06;08940;Indefinit;1984;933757193;societatocellairedecornella@hotmail.com;;;;;;PLAÇA TÀRREGA, S/N
63;ASSOCIACIÓ DE VEÏNS DEL CASC ANTIC DE CORNELLÀ DE LLOBREGAT;Veïnals;;;;;;;;;;;D-02;B-01;08940;Indefinit;1992;934743042;avcascantic@hotmail.com ;avcascantic.entitatscornella.cat;;;;;RUBIÓ I ORS, 158, 1º
64;CLUB HANDBOL RÀPID CORNELLÀ;Esportives;;;;;;;;;;;D-06;B-07;08940;Indefinit;1984;933769049;comunicacion@handbol-cornella.es;www.handbol-cornella.es;;;;;AVD. LÍNEA ELÉCTRICA Nº 9 3º 3º
65;C.F. BETICO LA ESPERANZA;Esportives;;;;;;;;;;;D-04;B-05;08940;Indefinit;1982;;beticolaesperanza@hotmail.com;beticoesperanza.blogspot.com;;;;;JOSE FITER, 35-37, ENT. 2ª
66;COORDINADORA CONTRA LA MARGINACION;Suport social;;;;;;;;;;;D-05;B-06;08940;Indefinit;1990;933750102;secretaria@coordinadoracm.org;;;;;;GARRAF, S/N.
67;ASSOCIACIÓ   ADELANTE  DE FAMILIARS I AFECTATS PER DROGODEPENDÈNCIES;Suport social;;;;;;;;;;;D-05;B-06;08940;Indefinit;1989;933751225;;;;;;;EMPORDÀ, S/N (Local AA.VV. Miranda)
68;ORFEÓ CATALONIA;Culturals;;;;;;;;;;;D-04;B-05;08940;Indefinit;1932;933765258;secretariaorfeo@gmail.com;orfeocatalonia.blogspot.com;;;;;TORRES I BAGES, 62
69;HERMANDAD STAS. ALODIA Y NUNILON;Culturals;;;;;;;;;;;D-02;B-01;08940;Indefinit;1956;629140553;mgserrana@gmail.com;www.santasdecornella.com;;;;;PL. ESGLÉSIA, 3 Parroquia Santa Maria
71;CLUB PETANCA LOS LLANOS;Esportives;;;;;;;;;;;D-06;B-07;08940;Indefinit;1984;933751378;;;;;;;AVD. LINEA ELECTRICA, Barrio Padró
72;BASQUET FEMENI CORNELLA;Esportives;;;;;;;;;;;D-04;B-01;08940;Indefinit;1989;934711207;club@basquetfemenicornella.com;www.basquetfemenicornella.com;;;;;MARIÀ BENLLIURE S/N . PAVELLÓ CAN CARBONELL
73;CLUB D ESCACS CORNELLA;Esportives;;;;;;;;;;;D-02;B-01;08940;Indefinit;1942;654724341;clubescacscornella@gmail.com;www.clubescacscornella.blogspot.com;;;;;C/ EDUARD GIBERT Nº29 BAIXOS
74;ASSOCIACIÓ DE PARES D ALUMNES DEL COL.LEGI PÚBLIC SANT MIQUEL;Educació i formació;;;;;;;;;;;D-04;B-05;08940;Indefinit;1989;933769056;santmiquel.ampa@gmail.com;www.santmiquelampa.com;;;;;DOMENECH I MUNTANER, 1-5 Col·legi Sant Miquel
75;CENTRE D ESPLAI INFANTIL I JUVENIL GAVINA;Juvenils;;;;;;;;;;;D-05;B-06;08940;Indefinit;1986;933752800;ceijgavina@gmail.com;;;;;;PLAÇA LINDAVISTA S/N
76;ASSOC. DE MARE I PARES D´ALUMNES DEL  CEIP IGNASI IGLESIAS;Educació i formació;;;;;;;;;;;D-04;B-05;08940;Indefinit;1991;717712992;ampaignasiglesias@gmail.com;www.ampaignasiglesias.blogspot.com;;;;;MARIA BENLLIURE Nº 29.
77;FEDERACIÓ COMARCAL D´ASSOCIACIONS VEÏNALS DEL BAIX LLOBREGAT ( FAVBAIX );Veïnals;;;;;;;;;;;D-04;B-05;08940;Indefinit;1987;934710545;favbaix@confavc.cat;;;;;;DOMENECH I MUNTANER, 28 locals 5-6
78;ASSOCIACIÓ DE PARES D ALUMNES DEL COL.LEGI PÚBLIC ABAT OLIBA DE CORNELLÀ;Educació i formació;;;;;;;;;;;D-02;B-01;08940;Indefinit;1975;933779005;ampabatoliba@gmail.com;ampaabatolibacornelladellobregat.com;;;;;SORRAL DEL RIU, S/N Col·legi Abat Oliba
79;UNIÓ ESPORTIVA CORNELLÀ (U.E.CORNELLÀ);Esportives;;;;;;;;;;;D-05;B-06;08940;Indefinit;1951;934741063;info@uecornella.cat;uecornella.cat;;;;;C/ SORRAL DEL RIU S/N ( Campo fútbol Municipal de Cornellà)
80;AGRUPACIO SARDANISTA DE CORNELLA;Culturals;;;;;;;;;;;D-02;B-01;08940;Indefinit;1968;628150968;info@agrupaciosardanista.cat;www.agrupaciosardanista.cat;;;;;EDUARD GIBERT, 29 (Patronat Cultural i Recreatiu)
81;ASSOCIACIÓ DE MARES I PARES D´ALUMNES DE L´ESCOLA ANSELM CLAVÉ;Educació i formació;;;;;;;;;;;D-02;B-01;08940;Indefinit;1972;933774343;ampaanselmclave@gmail.com;http://ampaanselmclavecornella.blogspot.com;;;;;DR. CARULLA, 1 Col·legi Anselm Clavé
83;ASSOCIACIÓ DE MARES I PARES D´ALUMNES DE L´ESCOLA ALEXANDRE GALÍ.;Educació i formació;;;;;;;;;;;D-04;B-07;08940;Indefinit;1987;626894013;ampalexandregali@gmail.com;;;;;;CIRERER, 1-7 Col·legi Alexandre Galí
84;ASSOCIACIÓ DE VEÏNS BARRI RIERA;Veïnals;;;;;;;;;;;D-02;B-02;08940;Indefinit;1972;934750357;avvriera@terra.com;avvriera.entitatscornella.cat;;;;;SANT JERONI, 41-43, BAIXOS
85;ESPORT CICLISTA CORNELLA;Esportives;;;;;;;;;;;D-02;B-01;08940;Indefinit;1992;659039251;jportetf@hotmail.com;www.esportciclistacornella.com;;;;;LASARTE, 6, BAIXOS
86;ASSOCIACIÓ DE JUBILATS I PENSIONISTES DEL BARRI ALMEDA;Gent gran;;;;;;;;;;;D-03;B-03;08940;Indefinit;1986;933776954;casalalmeda@gmail.com;;;;;;DOLORS ALMEDA S/N. ESTACIÓ
87;CLUB CORNELLÀ FÚTBOL SALA;Esportives;;;;;;;;;;;D-05;B-06;08940;Indefinit;1993;933762943;info@cornellafs.com;www.cornellafs.com;;;;;AVDA. LINEA ELECTRICA Nº1-7
88;ASSOCIACIÓ VEÏNAL DEL BARRI DE LA GAVARRA;Veïnals;;;;;;;;;;;D-05;B-06;08940;Indefinit;1974;933757330;avgavarra@confavc.cat;www.avlagavarra.org;;;;;ERMENGOL GOULA, 24, BAIXOS
89;ASSOCIACIO D EXALUMNES I AMICS DEL CFA CORNELLÀ DE LLOBREGAT;Educació i formació;;;;;;;;;;;D-07;B-07;08940;Indefinit;1990;;;;;;;;IGNASI IGLESIAS Nº 7
90;ASSOCIACIÓ DE GENT GRAN DE CORNELLÀ-CENTRE;Gent gran;;;;;;;;;;;D-02;B-01;08940;Indefinit;1974;934741380;;;;;;;RUBIÓ I ORS Nº 106-108. BAIXOS
91;ASSOCIACIO DE PARES ALUMNES C. BETANIA;Educació i formació;;;;;;;;;;;D-05;B-06;08940;Indefinit;1988;615185868;ampa@escolabetania.es;;;;;;BONAVISTA, 38 Col·legi Betania
92;ASSOCIACIÓ  ALCER  DE BARCELONA;Suport social;;;;;;;;;;;D-02;B-03;08902;Indefinit;1981;;alcerbarcelona@hotmail.com;;;;;;AVG.CARRILET, 78, ENTL. 1ª i 2ª
93;ASOCIACIÓN DE VECINOS DEL BARRIO ALMEDA;Veïnals;;;;;;;;;;;D-03;B-03;08940;Indefinit;1974;931646466;aavv.almeda@gmail.com;www.aavv-almeda.blogspot.com;;;;;SANT FERRÁN,  37 BAIXOS 
94;PENYA BARÇA;Esportives;;;;;;;;;;;D-02;B-01;08940;Indefinit;1970;933770229;info@pcr.cat;;;;;;MN. CINTO VERDAGUER, 52 BAIXOS
95;SOCIETAT CORAL LA UNIO;Culturals;;;;;;;;;;;D-02;B-01;08940;Indefinit;1854;618619412;sc.launio@launiodecornella.cat;www.launiodecornella.cat;;;;;CAMI DE LA DESTRALETA, S/N
96;ASSOCIACIÓ DE MARES I PARES D´ALUMNES DE L´INSTITUT JOAN MIRÓ;Educació i formació;;;;;;;;;;;D-02;B-02;08940;Indefinit;1979;933779728;ampa.iesjoanmiro@gmail.com;;;;;;VERGE MONTSERRAT, S/N I.E.S. Joan Miró
99;COORD. DE ENTIDADES FLAMENCAS Y ANDALUZAS DE CORNELLA;Culturals;;;;;;;;;;;D-07;B-07;08940;Indefinit;1993;933752716;jaruiz@draft.cat;;;;;;GERDERA, S/N Centre Cívic Sant Ildefons
100;ASSOCIACIO DE MARES I PARES D ALUMNES DE L´INSTITUT FRANCESC MACIA;Educació i formació;;;;;;;;;;;D-04;B-05;08940;Indefinit;1990;934740842;ampamacia@gmail.com;;;;;;JOAN MARAGALL, S/N I.E.S. Francesc Macia
101;FUNDACIÓ PRIVADA EL LLINDAR;Educació i formació;;;;;;;;;;;D-03;B-03;08940;Indefinit;2005;933773189;aulataller@elllindar.org;;;;;;CRTA. DE L´HOSPITALET S/N PARC DE CAN MERCARDER
102;FEDERACIO D ASSOCIACIONS DE MARES I PARES D ALUMNES D´ALUMNES DE CORNELLÀ -FAPAC;Educació i formació;;;;;;;;;;;D-06;B-07;08940;Indefinit;1986;933753451;fampacornella@gmail.com;fampacornella.blogspot.com;;;;;AVD.SANT ILDEFONS, 24, BXS
105;ASSOC. DE PARES I MARES D ALUMNES ESCOLA  DOLORS ALMEDA;Educació i formació;;;;;;;;;;;D-03;B-03;08940;Indefinit;1988;934800351;ampadolorsalmeda@gmail.com;www.ampada-entitatscornella;;;;;BALTASAR ORIOL, NÚM. 66 Col·legi Dolors Almeda
107;ASOCIACION PRO DISMINUIDOS DE CORNELLA (APRODICO);Suport social;;;;;;;;;;;D-07;B-07;08940;Indefinit;1990;933760382;aprodico_associacio@yahoo.es;;;;;;ALMOGÀVERS, S/N Antic Col·legi Roger de Llúria
110;ASSOCIACIÓ CULTURAL GENT I FUTUR;Culturals;;;;;;;;;;;D-05;B-06;08940;Indefinit;2008;933762011;gentifutur@gmail.com;gentifutur.entitatscornella.cat;;;;;MOSSÈN ANDREU, 13-19, 4ª planta Centre Cívic Joan N. Garcia-Nieto
113;ASSOCIACIÓ DE PARES I MARES D ALUMNES DE L´ ESCOLA MUNICIPAL DE MUSICA ROSER CAB;Educació i formació;;;;;;;;;;;D-05;B-06;08940;Indefinit;1993;933763211;ampemmc@gmail.com;ampemmc.blogspot.com;;;;;MOSSEN ANDREU, 13-19 Centre Civic Joan N. Garcia-Nieto
116;CONFEDERACIÓ SINDICAL DE LA COMISSIÓ OBRERA NACIONAL DE CATALUNYA;Polítiques i sindicals;;;;;;;;;;;D-04;B-06;08940;Indefinit;1978;933779292;bllapag@ccoo.cat;www.ccoo.cat/baixllobregat;;;;;CTRA. ESPLUGUES, 68 Edifici CC.OO.
117;ASOC. CULT.RECREATIVA PEÑA DOMINO SAN ILDEFONSO;Culturals;;;;;;;;;;;D-07;B-07;08940;Indefinit;1994;934713301;a.r.c.p.domino@gmail.com;www.domino.entitatscornella.cat;;;;;AV. SANT ILDEFONS,  1 - 3 - 5 (part posterior)
118;CASTELLERS DE CORNELLA;Culturals;;;;;;;;;;;D-02;B-01;08940;Indefinit;1993;635885712;colla@castellerscornella.org;www.castellersdecornella.cat;;;;;EDUARD GIBERT, NÚM. 29 (Patronat Cultural i Recreatiu)
120;C.D. FONTSANTA PETANCA;Esportives;;;;;;;;;;;D-04;B-04;08940;Indefinit;1979;933779295;vigafu@yahoo.es;;;;;;FREDERICA MONTSENY I MANYÉ S/N
121;ASSOCIACIÓ DE MARES I PARES D ALUMNES DE L´ESCOLA MEDITERRÀNIA. ;Educació i formació;;;;;;;;;;;D-03;B-06;08940;Indefinit;1994;608272551;ampa.mediterrania@yahoo.es;ampamediterrania.entitascornella.cat;;;;;BONAVISTA, S/N Col·legi Mediterrànea
125;CLUB PETANCA CORNELLA;Esportives;;;;;;;;;;;D-02;B-02;08940;Indefinit;1992;652778106;clubpetancacornella@yahoo.es;;;;;;AVDA. BAIX LLOBREGAT S/N (Nou Estadi Municipal)
126;UNION GENERAL DE TRABAJADORES DE CATALUNYA;Polítiques i sindicals;;;;;;;;;;;D-04;B-01;08940;Indefinit;1988;932619009;ugtbaix@baixllobregat.ugt.org;www.ugtbaix.com;;;;;REVOLT NEGRE 12
127;CLUB PETANCA BONANZA;Esportives;;;;;;;;;;;D-04;B-05;08940;Indefinit;1977;690320113;cpbonanza@gmail.com;;;;;;MIGUEL DE CERVANTES S/N
130;UNIFICACIO ESPORTIVA SANT ILDEFONS;Esportives;;;;;;;;;;;D-07;B-07;08940;Indefinit;1994;935971404;infosani@uesantildefons.com;www.uesantildefons.com;;;;;SALVADOR ALLENDE S/N
132;ASSOCIACIO EURODONA;Gènere;;;;;;;;;;;D-05;B-06;08906;Indefinit;1992;933751044;eurodona@gmail.com;;;;;;C/ LLOBREGAT, 2 1º 2º
133;CARITAS INTERPARROQUIAL CORNELLA;Suport social;;;;;;;;;;;D-04;B-05;08940;Indefinit;1976;933764356;;;;;;;FELIU CODINA Nº 4
134;ASSOCIACIÓ DE DONES ÀRTEMIS;Gènere;;;;;;;;;;;D-02;B-06;08940;Indefinit;1995;666901892;clarabgl@gmail.com;;;;;;EDUARD GIBERT, NÚM. 29 (Patronat Cultural i Recreatiu)
136;COORDINADORA D´ENTITATS PER LES FESTES DEL BARRI SANT ILDEFONS;Suport social;;;;;;;;;;;D-07;B-07;08940;Indefinit;1994;600538080;cbarriosanildefonso@hotmail.com;;;;;;GERDERA, S/N Centre Cívic Sant Ildefons
137;FOMENT DE CULTURA POPULAR DE CORNELLA;Culturals;;;;;;;;;;;D-04;B-05;08940;Indefinit;1995;;fomentcultura@gmail.com;http://fomentcultura.entitatscornella.cat;;;;;TORRAS I BAGES, 62 Local Orfeó Catalonia
138;PENYA BARCELONISTA D ALMEDA;Esportives;;;;;;;;;;;D-03;B-03;08940;Indefinit;1995;651161775;penya.almeda@gmx.es;;;;;;AVDA. SANT FERRAN Nº 37
139;ASSOCIACIÓ DE MARES I PARES D´ALUMNES DE L´ESCOLA MOSSÉN JACINT VERDAGUER;Educació i formació;;;;;;;;;;;D-05;B-07;08940;Indefinit;1985;933766079;ampajverdaguer@gmail.com;;;;;;SALVADOR ALLENDE, 16 Col·legi Jacint Verdaguer
140;CLUB COCOS ESPORT I CULTURA;Esportives;;;;;;;;;;;D-04;B-06;08940;Indefinit;1994;934749900;;;;;;;CTRA. D ESPLUGUES, NÚM. 68 (Edifici CC.OO.)
141;FEDERACIO APLEC DE LA SARDANA DE CORNELLA DE LLOBREGAT;Culturals;;;;;;;;;;;D-02;B-01;08940;Indefinit;1995;936541692;antonivilafigueras@gmail.com;;;;;;EDUARD GIBERT, NÚM. 29 (Patronat Cultural i Recreatiu)
142;ASSOC.DE MARES I  PARES D ALUMNES DE L´ESCOLA TORRE DE LA MIRANDA;Educació i formació;;;;;;;;;;;D-07;B-07;08940;Indefinit;1994;933760879;ampatorremiranda@hotmail.com;ampamiranda.blogspot.com;;;;;ALMOGAVERS, S/N Col·legi Torre de la Miranda
145;CRUZ ROJA ESPAÑOLA;Cooperació al desenvolupament, solidaritat i pau;;;;;;;;;;;D-02;B-01;08940;Indefinit;1911;934741412;cornella@creuroja.org;www.creuroja.cornella.org;;;;;RUBIO I ORS, 104, BXS.
148;DANSA I RITME;Culturals;;;;;;;;;;;D-02;B-01;08940;Indefinit;1995;676523052;dansairitme@hotmail.com;dansairitme.entitatscornella.cat;;;;;C/SORRAL DEL RIU S/N
149;FEDERACIO CATALANA DE TENNIS;Esportives;;;;;;;;;;;D-01;B-02;08035;Indefinit;1987;935677500;cornella@fctennis.cat;www.fctennis.cat/act/act_cornella/;;;;;C/ VERGE DE MONTSERRAT S/N
150;SECCIO ESPORTIVA AMPA  CEIP SANT MIQUEL;Esportives;;;;;;;;;;;D-04;B-05;08940;Indefinit;1995;933769056;santmiquel.ampa@gmail.com;www.ampasmiquel.es;;;;;DOMENECH I MUNTANER, NÚM. 1 - 5 (Col·legi Sant Miquel)
151;ASSOC. DE MARES I PARES D ALUMNES DE L´INSTITUT MIQUEL MARTÍ I POL;Educació i formació;;;;;;;;;;;D-02;B-02;08940;Indefinit;1990;933775657;ampamartiipol2@gmail.com;;;;;;VERGE  MONTSERRAT, S/N Col·legi Martí i Pol
152;ASSOCIACIÓ DE MARES I PARES D ALUMNES ESCOLA MARE DE DÉU DE MONTSERRAT;Educació i formació;;;;;;;;;;;D-06;B-07;08940;Indefinit;1986;933755000;ampa.montserrat@hotmail.com;http://ampamontserrat.cornella.ppe.entitats.diba.cat;;;;;AV. LINEA ELECTRICA, 2-4 Col·legi Verge de Montserrat
157;ASOCIACION CULTURAL DEPORTIVA PERU;Culturals;;;;;;;;;;;D-07;B-07;08940;Indefinit;1996;933485370;jocara69@hotmail.es;;;;;;AVINGUDA SANT ILDEFONS Nº 18.3º 3º
158;A.P.A. CP. SANT ILDEFONS;Educació i formació;;;;;;;;;;;D-06;B-07;08940;Indefinit;1979;697192108;vcruiz79@hotmail.com;;;;;;AV.SANT ILDEFONS, 24 Col·legi Sant Ildefons
159;ASOC.CULT.EXTREMEÑA SAN ISIDRO LABRADOR;Culturals;;;;;;;;;;;D-05;B-06;08940;Indefinit;1995;933755503;cexcornella@gmail.com;;;;;;BONAVISTA, NÚM. 4 - 6
160;L AVENÇ DE CORNELLA, ASSOCIACIÓ PEL PATRIMONI HISTÒRIC I LA CULTURA;Culturals;;;;;;;;;;;D-05;B-06;08940;Indefinit;1994;;correu@lavencdecornella.cat;;;;;;C/ MENENDEZ I PELAYO 52
162;CENTRE D ESTUDIS COMARCALS BAIX LL.;Culturals;;;;;;;;;;;D-01;B-010;08980;Indefinit;1988;936663527;cecbll@llobregat.info;www.cecbll.cat;;;;;CARRER ESTELI, 10
163;ASSOCIACIÓ GRUP VOCAL ZETZÀNIA;Culturals;;;;;;;;;;;D-02;B-01;08940;Indefinit;1996;658573855;zetzania@gmail.com;;;;;;Masia Can Tirel. C/ DE LA DESTRALETA S/N
164;HERMANDAD DE LA CORONADA EN CATALUÑA;Culturals;;;;;;;;;;;D-04;B-07;08940;Indefinit;1995;690066535;lacoranadaencatalunya@hotmail.es;;;;;;C/ PENEDÉS Nº 10.ESGLÈSIA SANT FELIP NERI DE LA FONTSANTA-FATJÓ
166;SALUT MENTAL BAIX LLOBREGAT, ASSOCIACIO DE FAMILIARS;Suport social;;;;;;;;;;;D-01;B-01;08940;Indefinit;1996;933778890;espai3cornella@hotmail.com;;;;;;PLAÇA ENRIC PRAT DE LA RIBA 6-8 ( CENTRE DE DIA SANT JOAN DE DEU ) 08940 CORNELL
167;ASSOCIACIO VENEDORS MERCAT MPAL.SANT ILDEFONS;Gremis i professionals;;;;;;;;;;;D-02;B-07;08940;Indefinit;1970;;msantildefons@gmaol.com;www.mercatsantildefons.com;;;;;AVD. SANT ILDEFONS, S/N Mercat Municipal de Sant Ildefons
168;ASSOCIACIÓ COORDINADORA D´ ENTITATS DEL BARRI DE LA GAVARRA;Suport social;;;;;;;;;;;D-05;B-06;08940;Indefinit;1996;933762011;;;;;;;MOSSEN ANDREU, 13-19, 4ª planta Centre Civic Joan N. Garcia-Nieto
171;ASSOCIACIO B.R.U.J.O. (BUSQUEDA,RECERCA,UNIO,JOCS,OCI);Juvenils;;;;;;;;;;;D-07;B-07;08940;Indefinit;1996;;;;;;;;GERDERA, S/N. Centre Cívic Sant Ildefons
172;ASSOCIACIÓN DE MADRES Y PADRES DE ALUMNOS  INSTITUT MARIA  AURÈLIA CAPMANY;Educació i formació;;;;;;;;;;;D-06;B-07;08940;Indefinit;1997;934710648;ampa@institutcapmany.cat;;;;;;GARROFER, S/N Col·legi Mª Aurelia Capmany
173;GRUP DE DONES DE FONTSANTA-FATJO;Gènere;;;;;;;;;;;D-04;B-04;08940;Indefinit;1996;;;;;;;;PLÇ.FONTSANTA, BLOQUE 1 - A, 2º 1ª
178;CLUB SOCIAL FORDIS;Suport social;;;;;;;;;;;D-05;B-01;08940;Indefinit;1981;933771005;;;;;;;DELICIAS, 3 Local
179;COMISSIO CIUTADANA PER A LA NORMALITZACIÓ LINGUISTICA DE CORN.;Culturals;;;;;;;;;;;D-02;B-01;08940;Indefinit;1989;933776624;;;;;;;CINEMA BEL, 13, 2º 1ª
180;CLUB INFANTIL JUVENIL SANFELIU-SANT ILDEFONS ;Juvenils;;;;;;;;;;;D-01;B-010;08906;Indefinit;1991;933383913;club@sanfeliu-santildefons.org;www.sanfeliu-santildefons.org;;;;;EMIGRANT Nº 25. BAIXOS 
181;ASSOCIACIÓ DE PARES D ALUMNES ESCOLA MUNICIPAL D´  EDUCAC. ESPECIAL VIROLAI;Educació i formació;;;;;;;;;;;D-05;B-06;08940;Indefinit;1997;933763159;ampaemeevirolai@hotmail.com;;;;;;MOSSEN ANDREU, S/N Col·legi Virolai
184;FUNDACIO PAU I SOLIDARITAT - CONC;Cooperació al desenvolupament, solidaritat i pau;;;;;;;;;;;D-04;B-06;08940;Indefinit;1991;934812912;pauisolidaritat@ccoo.cat;www.pauisolidaritat.ccoo.cat;;;;;CTRA. D ESPLUGUES, 68 Edifici CC.OO.
185;COMISSIÓ JORDIADA;Culturals;;;;;;;;;;;D-02;B-01;08940;Indefinit;1998;933772551;smontell@telefonica.net;;;;;;RUBIÓ I ORS, 232 BAIXOS
186;ASSOCIACIÓ COOPERACCIÓ;Cooperació al desenvolupament, solidaritat i pau;;;;;;;;;;;D-01;B-010;08002;Indefinit;1997;933183425;info@cooperaccio.org;;;;;;SANT HONORAT, 7 - PRINCIPAL
187;ASOC. CULTURAL ANDALUZA HIJOS DE PARADAS EN CATALUNYA;Culturals;;;;;;;;;;;D-01;B-010;08906;Indefinit;1988;932601306;acahpc@e-citilab.eu;acahpc.entitatscornella.cat;;;;;MIRALTA, 31, BAIXOS
191;A.F.A. BAIX LLOBREGAT (ASSOCIACIÓ DE FAMILIARS D ALZHEIMER DEL BAIX LLOBREGAT);Suport social;;;;;;;;;;;D-06;B-07;08940;Indefinit;1997;933790022;info@afabaix.org ;www.afabaix.org;;;;;AV. SANT ILDEFONS, S/N. Mercat Sant Ildefons
192;CLUB D ATLETISME CAN MERCADER;Esportives;;;;;;;;;;;D-01;B-01;08940;Indefinit;1998;667365605;crishuerga@canmercader.com;www.canmercader.com;;;;;PARC CAN MERCARDER. CTRA DE L´HOSPITALET
195;CONSELL ESPORTIU DEL BAIX LLOBREGAT;Esportives;;;;;;;;;;;D-01;B-010;08970;Indefinit;1981;936852039;cebllob@cebllob.cat;www.cebllob.cat;;;;;CTRA. NACIONAL. 340 km 1249 (Parc Torreblanca)
