ID;ENTITAT;SECTORSEMANTIC1;SECTORSEMANTIC2;SECTORSEMANTIC3;SIGLA;CODI_CARRER;CARRER;NRO;BIS;ESCALA;PIS;PORTA;CODI_DIVISIO_TERRITORIAL_ADMINISTRATIVA;CODI_DIVISIO_TERRITORIAL;CODI_POSTAL;AMBIT;ANY_CONSTITUCIO;TELEFON;MAIL;WEB;UTMX;UTMY;LATITUD;LONGITUD;ADREÇA_COMPLETA
444;DEUS MOTOR MG;Culturals;;;;;;;;;;;D-05;B-06;08940;Indefinit;2012;629441702;deusmotor413@gmail.com;;;;;;AVDA. SALVADOR ALLENDE Nº 1. 3º 2º
445;LA RUE DEL SO;Culturals;;;;;;;;;;;D-02;B-02;08940;Indefinit;2014;629450806;laruedelsoproduccions@gmail.cat;;;;;;C/ FRANCESC LAYRET Nº 37. ÀTIC 2ª
446;ASOCIACIÓN POETAS DE CORNELLÀ;Culturals;;;;;;;;;;;D-05;B-06;08940;Indefinit;2014;609735250;poetasdecornella@hotmail.com;;;;;;C/ LAS ORIOLAS Nº 6. 2º 2º
447;ASSOCIACIÓ CULTURAL VIDA BALL;Culturals;;;;;;;;;;;D-04;B-04;08940;Indefinit;2014;645911541;acvidaball@gmail.com;;;;;;PLAÇA GANDESA S/N
448;ASOCIACIÓN PARA LA RECUPERACIÓN DE EQUIPOS INFORMÁTICOS EN DESUSO. REI;Ecologistes i medi-ambientals;;;;;;;;;;;D-05;B-06;08940;Indefinit;2014;;info@asociacionrein.es;;;;;;C/ EMPORDÀ Nº 3. 7º 1ª
449;ASSOCIACIÓ CORNELLÀ A MÀ;Culturals;;;;;;;;;;;D-02;B-01;08940;Indefinit;2015;;cornella.a.ma@gmail.com;;;;;;C/ RUBIÓ I ORS Nº 207. 4º 3º
450;ASOCIACIÓN MUSICAL MANUEL RODRÍGUEZ ORTIZ SAGRADA FAMILIA;Culturals;;;;;;;;;;;D-05;B-06;08940;Indefinit;2014;629675291;aamsagradafamilia@gmail.com;;;;;;C/ LLINARS Nº 60. BAIXOS
451;ASSOCIACIÓ DE MARES I PARES D´ALUMNES DE L´ESCOLA BRESSOL ARC DE SANT MARTÍ;Educació i formació;;;;;;;;;;;D-01;B-03;08940;Indefinit;2013;934753538;amparcdesantmarti@gmail.com;;;;;;AVDA. PAU PICASSO Nº 51
452;IGLESIA EVANGELICA BAUTISTA DE CORNELLÀ;Religioses;;;;;;;;;;;D-05;B-06;08940;Indefinit;1971;933760942;iebcornella2014@gmail.com;;;;;;C/ RAMONEDA Nº 28 BAIXOS
453;ASOCIACIÓN DE HARMONIA Y INTERCULTURALIDAD;Culturals;;;;;;;;;;;D-02;B-01;08940;Indefinit;2009;688340365;sef102f@gmail.com;;;;;;C/ BONVEÍ,53
454;UNIÓN DE IGLESIAS CRISTIANAS ADVENTISTAS DEL SÉPTIMO DÍA DE ESPAÑA;Religioses;;;;;;;;;;;D-02;B-01;08940;Indefinit;1968;675908873;jdolcet@adventista.es;;;;;;C/ EDUARD GIBERT Nº 34
455;MICROCORNELLA TEATRE;Culturals;;;;;;;;;;;D-05;B-06;08940;Indefinit;2015;;microcornellateatre@gmail.com;microcornellateatre.com;;;;;C/ BELLATERRA Nº 28 1º 1º
456;XARXA DE DONES EMPRENEDORES DE CORNELLÀ;Culturals;;;;;;;;;;;D-02;B-01;08940;Indefinit;2014;;xdonescor@gmail.com;;;;;;C/ JAVIMEL Nº 21
457;FÚTBOL CLUB CORNELLÀ;Esportives;;;;;;;;;;;D-04;B-04;08940;Indefinit;2013;667594130;futbolclubcornella@gmail.com;;;;;;C/ FEDERICA MONTSENY Nº 2
458;ASSOCIACIÓ ATENEU POPULAR DE CORNELLÀ;Culturals;;;;;;;;;;;D-05;B-06;08940;Indefinit;2012;;ateneupopularcornella@gmail.com;;;;;;C/ JACINT GUERRER Nº 8
459;ASSOCIACIÓ EDUCATIVA TROMPITXOL;Educació i formació;;;;;;;;;;;D-05;B-06;08940;Indefinit;2004;680125674;trompitxol@hotmail.com;;;;;;C/ FREDERIC SOLER Nº 83 1º 2 º
460;ASSOCIACIÓ NOVA OPORTUNITAT D´ADOPCIONS CORNELLÀ;Suport social;;;;;;;;;;;D-05;B-06;08940;Indefinit;2014;661088777;anoac-@hotmail.com;www.anoac.es.te;;;;;C/ PRINCIPADO DE ANDORRA Nº 7. 5º 4º
461;CLUB FARTUCS BITLLES I BOWLING;Esportives;;;;;;;;;;;D-02;B-01;08940;Indefinit;2003;;fartucsbitlles@gmail.com;;;;;;C/ LASARTE Nº 2 4º 1ª
462;AMPA INSTITUT CORNELLÀ;Educació i formació;;;;;;;;;;;D-06;B-07;08940;Indefinit;2015;;ampainstitutcornella@gmail.com;;;;;;AVGDA. SANT ILDEFONS Nº 24
463;JOVENTUT OBRERA CRISTIANA NACIONAL DE CATALUNYA I LES ILLES;Religioses;;;;;;;;;;;D-07;B-07;08940;Indefinit;2013;;joczonasud@gmail.com;;;;;;AVDA. SANT ILDEFONS Nº 15
464;CLUB ESPORTIU KYOKUKAN;Esportives;;;;;;;;;;;D-02;B-01;08940;Indefinit;2005;931829321;kyokukan@kyokukan.com;;;;;;C/ RUBIÓ I ORS Nº 11
465;ASSOCIACIÓ B-RETINA;Culturals;;;;;;;;;;;D-01;B-07;08940;Indefinit;2015;;b.retina2015@gmail.com;;;;;;PLAÇA ALMOGAVERS S/N. EDIF. ROGER DE LLÚRIA
466;ASSOCIACIÓ DE MARES I PARES D´ALUMNES DE L´ESCOLA BRESSOL MUNICIPAL MAG MAGINET;Educació i formació;;;;;;;;;;;D-06;B-07;08940;Indefinit;2016;;ampamagmaginet@gmail.com;;;;;;PLAÇA DELS ALMOGAVERS Nº 2
467;ASSOCIACIÓ CULTURAL HYPERION;Culturals;;;;;;;;;;;D-05;B-06;08940;Indefinit;2015;;asociacion.cultural.hyperion@gmail.com;;;;;;C/ MOSSÈN ANDREU Nº 17
468;ASSOCIACIÓ D´AMICS DELS PRODUCTES ARTESANS ( APAT );Culturals;;;;;;;;;;;D-03;B-03;08940;Indefinit;2016;;associacioapat@gmail.com;;;;;;C/ PASSATGE DOLORS ALMEDA Nº 23 BAIXOS
470;CATALUNYA COALESCE CRIKET CLUB;Esportives;;;;;;;;;;;D-03;B-03;08940;Indefinit;2012;673636096;malikadnan78@gmail.com;;;;;;C/ DOLORS ALMEDA Nº 84. PLANTA 1º PORTA Nº 3
471;ASSOCIACIÓ CORRESOLIDARIS;Suport social;;;;;;;;;;;D-07;B-07;08940;Indefinit;2015;661344781;info@corresolidaris.org;;;;;;C/ FREIXE Nº 3 2º 3ª
472;CLUB PETANCA BARRI CENTRE;Esportives;;;;;;;;;;;D-02;B-02;08940;Indefinit;2016;689312807;cpbarricentre@gmail.com;;;;;;AVDA. BAIX LLOBREGAT S/N
473;ASSOCIACIÓ JAZZ AND BEER;Culturals;;;;;;;;;;;D-05;B-06;08940;Indefinit;2016;656616040;info@jazzandbeer.org;;;;;;C/ CATALANS Nº 25. 4º 2º
474;ASOCIACIÓN ESPAÑOLA DE DESARROLLO, ASESORAMIENTO Y FORMACIÓN A LAS EMPRESAS ( DE;Gremis i professionals;;;;;;;;;;;D-05;B-06;08940;Indefinit;2016;937608348;lolalusan.63@gmail.com;;;;;;CTRA D´ESPLUGUES Nº 64. BAIXOS
475;ASSOCIACIÓ CULTURAL BAIX LLOBREGAT  BALLEM ;Culturals;;;;;;;;;;;D-05;B-06;08940;Indefinit;2016;636043128;rosapaez1979@hotmail.com;;;;;;C/ BELLATERRA 6 . BAIXOS
476;ASSOCIACIÓ DE DONES PER LA INTEGRACIÓ TIUTMIN;Gènere;;;;;;;;;;;D-06;B-07;08940;Indefinit;2016;632958700;asociaciodedones@gmail.com;;;;;;C/ MIRANDA Nº 31-33. 1º B. ESCALA A
477;ASSOCIACIÓ XARXA SOLIDÀRIA CIUTADANA;Cooperació al desenvolupament, solidaritat i pau;;;;;;;;;;;D-06;B-07;08940;Indefinit;2017;678602153;xarxa.solidaria.ciutadana@gmail.com;;;;;;AVGDA. SANT ILDEFONS 1-3-5
478;ASOCIACIÓN CULTURAL SOCIAL Y DEPORTIVA INTERNACIONAL DE COLOMBIANOS POR EL MUNDO;Culturals;;;;;;;;;;;D-07;B-07;08940;Indefinit;2016;646736261;asoincol18@gmail.com;;;;;;C/ GERDERA Nº 1  5º 2º
479;IGLESIA PENTECOSTAL UNIDA EN EUROPA;Religioses;;;;;;;;;;;D-02;B-02;08940;Indefinit;2002;676533224;secretaria@ipue.es;;;;;;C/ COBALTO Nº 25. PGNO IND. ESTE
480;CLUB TRIATLÓ CORNELLÀ;Esportives;;;;;;;;;;;D-03;B-03;08940;Indefinit;2017;655469752;triatlocornella@gmail.com;;;;;;CTRA. DE L´HOSPITALET S/N. PARC DE CAN MERCADER
481;FUNDACIÓN PRIVADA UE CORNELLÀ;Esportives;;;;;;;;;;;D-02;B-02;08940;Indefinit;2013;934741063;infouecornella@gmail.com;;;;;;C/ SORRAL DEL RIU S/N
482;FUNDACIÓ PEL FOMENT DE LA SOCIETAT DEL CONEIXEMENT;Defensa i protecció dels animals;;;;;;;;;;;D-04;B-04;08940;Indefinit;2004;;citilab@info.ue;;;;;;PLAZA CAN SURIS S/N
