nombre,tipoasociacion,numRegistro,cif,direccion,codpostal,longitud,latitud,telefono,fax,email,fconstitucion
"Asociación Juvenil La Torrecilla","Asociación de Jóvenes","383","G-30455877","Ermita de Burruezo, Buzón 5","30817","","","687 277 263","","","11/12/2004 0:00:00"
"Asociación Ntra. Sra. Virgen de la Salud, la Hoya","Asociación Religiosa","386","G-73577918","Dip. La Hoya, C/ Mayor, Escuela Juan Navarro García","30816","","","968 481 747","","","05/12/2007 0:00:00"
"Club de Padel de Lorca","Asociación Deportiva","387","G-73472474","C/ Pio XII, 21 B 2º A","30800","","","609 886 864","","info@padelorca.es","08/08/2006 0:00:00"
"Asociación Deportivo Cultural Lorca Radio-Control de Automodelismo","Asociaciones de ocio","388","G-73573586","Alameda de Cervantes, nº 61 - 4º D","30800","","","609 216 499","","pegalfe@hotmail.com","28/01/2008 0:00:00"
"La Hoya Lorca, Club de Fútbol","Asociación Deportiva","389","G-73332645","Dip. La Hoya, Ctra. Nueva","30816","","","868 818 350","868 818 350                                       ","lahoyalorcacf@gmail.com","15/09/2002 0:00:00"
"Asociación Cultural Cena Pagana","Asociación Cultural","390","G-73581043","C/ Franco, 18","30800","","","620 876 909","","cenapagana@gmail.com","16/04/2008 0:00:00"
"Club de Pensionistas y Jubilados de Campillo","Club de Pensionistas","348","G-30305056","Centro Social del Campillo. Diputación Campillo.","30813","","","","","","10/11/1995 0:00:00"
"Asociación de Costaleros de Santa Ana de Felí","Asociación Religiosa","391","G-73370454","Dip. Purias, Ermita de Felí","30813","","","608 469 613","","","15/03/2005 0:00:00"
"Asociación de Criadores de Gallina de Raza Murciana","Organizaciones Empresariales","392","G-73584310","Dip. Purias, Camino Búcanos, Buzón 1-5","30813","","","639 786 751","","acriadmur@gmail.com",""
"Asociación Cultural Albaraka","Asociación Cultural","393","G-73564007","C/ Ortega melgares, 71 - 2º E","30800","","","968 472 514 / 648 601 609","","afi8970@hotmail.com","01/12/2007 0:00:00"
"FUNDACIÓN CHINGUETTI","Asociación con Fines Asistenciales","396","G-30757710","C/ Musso Valiente, 2, 5º D","30800","","","968 175 835","968 137 652                                       ","chinguetti@fundacionchiguetti.com","11/04/2002 0:00:00"
"Asociación Grupo Scout Ciudad del Sol","Asociación de Animación Sociocultural","398","G-73481236","C/ Leonés, Ap. Correos: 20","30800","","","968 464 008","968 463 414                                       ","scoutciudadsol@terra.es","07/06/2006 0:00:00"
"Club Monos Peluos","Asociación Deportiva","399","G-73590861","Vereda de Churra, nº 3, Panel 22 - Buzón 30","30815","","","629 631 718","","","03/07/2008 0:00:00"
"Asociación Comarcal de Empresarios de Ganadería y Agricultura de la Comarca del Guadalentín","Organizaciones Empresariales","403","G-73600744","C/ Abad de los Arcos, 3","30800","","","968 444 604","968 444 604                                       ","ceclor@ceclor.net","15/04/2008 0:00:00"
"Asociación Sociedad Activa","Asociación con Fines Asistenciales","407","G-73596538","C/ Cueto, 10","30800","","","636 973 008","","sociedadactivalorca@gmail.com","07/07/2008 0:00:00"
"Automóvil Club Zarcilla de Ramos","Asociación Deportiva","408","G-73612301","Dip. Zarcilla de Ramos, C/ Ancha, nº 9","30810","","","968 499 372","968 499 372                                       ","","25/11/2008 0:00:00"
"Asociación Amigos del Pradico Ermita de San Antón","Cultural y tradiciones populares","409","G-73609570","Dip. Parrilla, Local Social de Consejero","30811","","","","","","16/08/2008 0:00:00"
"Club de Pensionistas y Jubilados de Sagrada Familia.","Club de Pensionistas","355","30817","Centro Social de Sagrada Familia. Puente Resinoli. s/n","30817","","","","","","26/05/1998 0:00:00"
"Asociación Burkina Faso de Lorca","Asociación de Minorías Sociales","412","G-73605495","C/ Pedro Cárceles, 21","30800","","","680 960 843","","zas_ta@yahoo.fr","10/06/2008 0:00:00"
"ASOCIACIÓN PARA LA PROMOCIÓN SOCIO CULTURAL E INSERCIÓN LABORAL DE LA ETNIA GITANA Y OTROS COLECTIVOS EN RIESGO DE EXCLUSIÓN SOCIAL -ASPROSOCU-","Asociación de Minorías Sociales","413","G-30432231","Placica Nueva, 13, bajo","30800","","","868 922 123","868 922 123                                       ","lorca@asprosocu.org","30/11/1994 0:00:00"
"Unión de Pequeños Agricultores y Ganade3ros","Organizaciones Profesionales","414","G-30399653","C/ Nuñez de Arce, 2","30800","","","968 477 417","","","17/01/1994 0:00:00"
"Asociación Juvenil San Pedro, San Juan y Santa María","Asociación de Jóvenes","415","G-73618662","C/ Sicilia, 6","30800","","","677 711 563","","nuriapsanchez@hotmail.com","30/12/2008 0:00:00"
"Club de Pensionistas y Jubilados de San Antonio","Club de Pensionistas","349","G-30483176","Centro Social de San Antonio. Calle Mariscal Pedro Musso","30800","","","","","","13/03/1998 0:00:00"
"Asociación Cultural Deportiva de la Policía Local de Lorca ACUDEPOL 24","Asociación Cultural","416","G-73624389","Avda. Fuerzas Armadas (Cuartel Policía Local), s7n","30800","","","676 935 371","","","22/12/2008 0:00:00"
"Asociación Cultural Duende y Compás de Lorca","Asociación Cultural","417","G-73622870","Dip. Campillo, Ctra. de Águilas, nº 146 - 1º","30813","","","","","duendeycompasdelorca@gmail.com","05/12/2008 0:00:00"
"Asociación de Personas Mayores y Familiares Solidaridad Intergeneracional.","Asociación con Fines Asistenciales","418","G-49225980","Dip. Pulgara, s/n","30800","","","968 467 696","968 472 652                                       ","","10/03/2005 0:00:00"
"Asociación Juvenil Sutullena","Asociación de Jóvenes","419","G-73619306","Avda. de Sutullena, nº 2","30800","","","639 479 379","","",""
"Club de Pensionistas y Jubilados de Santa María","Club de Pensionistas","362","G-30594626","Centro Social de Santa María. C/ Sicilia, s/n","30800","","","","","","06/04/1998 0:00:00"
"Asociac ión Centro de Mediación","Asociación con Fines Asistenciales","420","G-73595282","C/Lope Gisbert, 36 - 3º - A","30800","","","968 449 275","968 449 275                                       ","mediacionyfamilia@telefonica",""
"Fundación Miguel Caballero","Asociación con Fines Asistenciales","423","G-73630584","Dip. Zarzadilla de Totana, C/ Grupo Escolar, 14","30814","","","638 413 499","","fundacionmiguelcabballero@gmail.com","03/02/2009 0:00:00"
"Asociación de Madres y Padres de Alumnos del Colegio Público San Fernando","Asociación de Padres y Madres de Alumnos","426","G-30028724","Avda. de Santa Clara, s/n","30800","","","968 465 022","968 465 571                                       ","",""
"Asociación de Guias Oficiales de Turismo de Lorca","Organizaciones Profesionales","427","G-73639973","C/ Juan Baenas, 18, esc. 2, Pl. 1ª A","30800","","","630 074 437","","guiartelorca@lorca.es","27/01/2009 0:00:00"
"Club Baloncesto Lorca","Asociación Deportiva","428","G-73639999","Dip. Tiata, C. Los Chaparros, 3","30800","","","607 471 750","","","02/07/2009 0:00:00"
"Lorca Fútbol Base","Asociación Deportiva","430","G-73639841","Avda. de Portugal, 28, bajo","30800","","","968 067 917 ","968 444 784                                       ","lorcafutbolbase@hotmail.com","14/07/2009 0:00:00"
"Asociación Amigos del Bonsai de Lorca","Asociaciones de ocio","431","G-73645897","C/José Mouliaá, 40","30800","","","619 391 719","","asociacionamigosdelbonsai@hotmail.com","22/06/2009 0:00:00"
"Asociación La Fábula (Asociación de Asistencia Psicosocial de la Región de Murcia)","Asociación con Fines Asistenciales","432","G-73577611","Alameda de la Constitucióin, s/n","30800","","","626 101 878","","jlmorlanes@hotmail.com","19/02/2008 0:00:00"
"Asociación Amigos de la Pasión de Lorca","Asociación Cultural","435","G-73545907","C/ Nogalte, 40, bajo","30800","","","","","","03/04/2008 0:00:00"
"ORGANIZACIÓN JUVENIL ESPAÑOLA","Asociación de Jóvenes","436","G-28556728","c/ Hernando de Burgos, 12","30800","","","665 832 226","","","18/07/1960 0:00:00"
"Asociación Scooter Club Lorca","Asociaciones de ocio","437","G-73628018","Alameda de la Constitución, junto casa del deporte, s/n","30800","","","687 949 553","","clementeromera@hotmail.com","30/01/2009 0:00:00"
"Club de Tenis Tie Break","Asociación Deportiva","438","G-73655151","C/ Quijero, 57","30800","","","610 812 863","","clubtiebreak@gmail.com","08/06/2009 0:00:00"
"Asociación de Autónomos para el Fomento de la Formación para el Empleo y la Competitividad en la Comunidad Autónoma de Murcia -AFMU-","Organizaciones Empresariales","439","G-73465684","Polígono Industrial Saprelorca, Paecela A","30817","","","670 099 655","","soporte@rentcomp.es","21/01/2006 0:00:00"
"Asociación de Cooperativas y Autónomos para el Fomento y Desarrollo Sociolaboral en Murcia -FECOMU-","Organizaciones Empresariales","440","G-73596561","Polígono Industrial Saprelorca, Paecela A","30817","","","670 216 528","","gestion1@jmf.es.telefonica.net","20/02/2006 0:00:00"
"Asociación Cuadrilla de Avilés","Cultural y tradiciones populares","367","G-73555328","C/ San Nicolás, nº 32","30812","","","968491399","","","04/11/2007 0:00:00"
"Asociación Juvenil La Loma de Lorca","Asociación de Jóvenes","369","G-73565814","C/ Arcipreste Montesinos, nº 13","30800","","","622749019","","","16/12/2007 0:00:00"
"Asociación Instituto de Desarrollo Comunitario de Murcia","Asociación de Cooperación Social","372","G-30485858","C/ Lope Gisbert, nº 18","30800","","","968257466","968351290","mercedes.idc@gmail.com","13/01/1995 0:00:00"
"Asociación de Vecinas y Vecinos Pedanía de Nogalte","Asociación de Vecinos","373","G-73567554","Diputación Nogalte, Panel 1, Buzón 4, nº 61","30890","","","686091330","","mariadenogalte@hotmail.com","02/01/2008 0:00:00"
"Asociación Club de Dardos Los Arcos","Asociaciones de ocio","441","G-73657017","C/ Los Arcos, nº 21","30800","","","678 624 494","","","18/12/2009 0:00:00"
"Asociación Cultural Virgen de los Dolores de Avilés","Asociación Cultural","442","G-73659666","Dip. Avilés, Barrio del Rocío, s/n","30812","","","686 975 438","","","06/10/2009 0:00:00"
"Club Ciclista La Hoya-Lorca","Asociación Deportiva","443","G-73653354","Ctra, del Hinojar - Local Asoc. Vecinos","30816","","","","","","01/11/2009 0:00:00"
"Ásociación de Pensionistas y Jubilados del Barrio de Apolonia La Candelaria.","Club de Pensionistas","444","G-73636441","Avda. Fuerzas Armadas, 32","30800","","","617837359","","","22/06/2009 0:00:00"
"Club Ajedrez Torre Alfonsina","Asociación Deportiva","445","G-73645707","C/ Alameda de Cervantes, 14, Bj, P3","30800","","","609 908 018","","juanjo.motos@hotmail.com","11/09/2009 0:00:00"
"Asociación Deportiva Fútbol Lorca","Asociación Deportiva","446","G-73666554","C/ Juan XXIII, nº 1","30800","","","","","",""
"Club Arcolorca","Asociación Deportiva","447","G-30522676","Callejón de los Frailes, 12","30800","","","667 495 001","","arcolorca@hotmail.com","16/02/1996 0:00:00"
"Feria de Artesanía de la Región de Murcia (FERAMUR)","Ferias","448","G-30124564","Plaza del Caño, 1","30800","","","968 477 313","968 477 416                                       ","jgomez@camaracomlorca.es","16/03/1986 0:00:00"
"Asociación de Padres y Madres IES Nº 6 de Lorca","Asociación de Padres y Madres de Alumnos","451","G-73671695","Ramblilla de Tejares (Cañada de Morales), s/n","30800","","","678 150 729","","piliki74@hotmail.com","04/03/2010 0:00:00"
"Asociación Juvenil LORKOS","Asociación de Jóvenes","452","G-73661282","Avda. Juan Carlos I, nº 58, 3º D","30800","","","637 291 407","","","08/01/2008 0:00:00"
"Asociación Altay Trabajo Social","Asociación con Fines Asistenciales","453","G-73669186","C/ Martín Morata, 6 - 3º C","30800","","","617 452 807","","altaytrabajosocial@gmail.com","26/11/2009 0:00:00"
"Asociación Club Rugby de Lorca","Asociación Deportiva","454","G-73672677","C/ Panadería, 13 - 2º D","30800","","","678 398 586","","clubderugby@gmail.com","29/04/2010 0:00:00"
"Asociación de Vendedores de Mercados de Lorca","Organizaciones Profesionales","455","G-73355729","Huerto de la Rueda","30800","","","600 873 210","","","21/01/2005 0:00:00"
"Asociación Juvenil Musical Propiedad Privada","Asociación de Jóvenes","456","G-73672917","C/ Padre García, 23 bajo","30800","","","665 832 226","","","11/05/2010 0:00:00"
"Asociación Club Ban Gkok","Asociación Deportiva","457","G-73154072","C/ Bordadora Apolonia Ros - bajo","30800","","","649 952 001","","juan-carrasco@hotmail.com","22/10/2001 0:00:00"
"Asociación Cultural Virgen del Quinche","Asociación de Minorías Sociales","458","G-73694317","C/ Abellaneda, 92","30800","","","610 897 513","","","21/11/2010 0:00:00"
"Asociación Juvenil Medicina Musical de Lorca","Asociación de Jóvenes","459","G-73686388","Ctra. de la Almenara, s/n, Buzón 155, Parcela O - Puente Botero","30813","","","677 092 597","","josemasax_93@hotmail.com","01/05/2010 0:00:00"
"Lorca Féminas Asociación Deportiva","Asociación Deportiva","460","G-73673642","C/ Martín Morata, 39","30800","","","639 791 160","968 481 799                                       ","lorcafeminas@gmail.com","15/05/2010 0:00:00"
"Club de Petanca Ramonete","Asociación Deportiva","461","G-73696478","Las Librilleras, Panel 6, Bz. 210","30876","","","","","","29/11/2010 0:00:00"
"Asociación Cultural y Social Amigos de la Danza de Lorca y Puerto Lumbreras","Asociación Cultural","462","G-73659112","C/ Terrer Leonés, 2 - 1ª","30800","","","968 464 658","968 464 658                                       ","","22/01/2010 0:00:00"
"Sociedad Cinegética Confederada Cazalor","Asociación Deportiva","463","G-73692477","Avda. Portugal, 11","30800","","","968 406 486","968 441 884                                       ","","25/10/2010 0:00:00"
"Asociación, ludoteca y Servicios Comunitarios Aserlud","Asociaciones de ocio","464","G-73696221","C/ Calderón de la Barca, 3 - 2º F","30800","","","666 997 863","","","13/12/2010 0:00:00"
"Asociación Juvenil Rule","Asociación de Jóvenes","465","G-73710626","Alameda de los Tristes, nº 4, Esc. 2, planta 1ª, Puerta C","30800","","","637 961 419","","","30/10/2010 0:00:00"
"Club Deportivo Tenis de Mesa San Fernando","Asociación Deportiva","466","G-73708653","Avda. Europa, Edificio Millenium VII, 27B 2 1 A","30800","","","968 471 643","968 471 506                                       ","tenisdemesasanfernando@hotmail.com","25/03/2011 0:00:00"
"Asociación de Madres y Padres de Alumnos del Colegio Ginés Arcas Romera","Asociación de Padres y Madres de Alumnos","467","G-73712523","Zarcilla de Ramos, Carretera de Lorca","30810","","","968 499 714","","",""
"Plataforma de Afectados por los Terremotos de Lorca","Asociación con Fines Asistenciales","469","","C/ Ingeniero Juan Escofet, 26, 1º, Izda.","30800","","","","","","14/05/2011 0:00:00"
"Asociación Veteranos OJE Lorca","Asociación de Animación Sociocultural","470","G-73711509","Camino Vera, 180, bajo","30813","","","968 471 643","968 471 506                                       ","veteranosojelorca@hotmail.com","12/04/2011 0:00:00"
"Asociación Intercultural Boliviamur","Asociación de Minorías Sociales","472","G-73721433","Alameda Corregidor Lapuente, 5","30800","","","638 882 424","","","15/11/2010 0:00:00"
"Club Triatlon Lorca","Asociación Deportiva","473","G-73713232","Alameda Menchirón, 5 - 4º A","30800","","","636 114 565","","clubtriatlonlorca@hotmail.com","25/04/2011 0:00:00"
"Asociación Cazalla-Intercultural","Asociación de Animación Sociocultural","474","G-73556987","C/ Corredera, 36","30800","","","637 570 105","","masetorra@euroaccion.com","24/05/2007 0:00:00"
"Asociación Rociera de Lorca","Asociaciones de ocio","475","G-73726747","Dip. de Torrecilla, Ctra. de la Estación","30800","","","968 464 247","968 464 247                                       ","","05/04/2011 0:00:00"
"Asociación ANIKE VOLUNTARIOS","Asociación con Fines Asistenciales","477","G-73718611","Travesía Castillo Xiquena, nº 1, 2º B","30800","","","","","","11/02/2011 0:00:00"
"Asociación de Madres y padres del CEIP San José de Lorca","Asociación de Padres y Madres de Alumnos","478","G-30064869","Alameda de los Tristes, s/n","30800","","","","","","06/03/2003 0:00:00"
"Asociación Cultural Cristiana Casa de la Esperanza","Asociación Religiosa","479","G-73739021","C/ Atrio de Santa María, s/n","30800","","","616 380 629","","","20/10/2011 0:00:00"
"Asociación Deportiva Almendricos","Asociación Deportiva","480","G-30543540","Diputáción Almendricos, C/ Escuelas Viejas, s/n","30893","","","625 110 699","","","27/11/1996 0:00:00"
"Asociación Juvenil Donarte","Asociación de Jóvenes","481","G-73744559","Dip. Tercia, C/ Baldazos, nº 22","30815","","","634 421 154","","","22/01/2012 0:00:00"
"Asociación Ghaneses de Lorca","Asociación de Cooperación Social","496","G-73721565","Camino Viejo del Puerto, 52, Bj.","30800","","","698506180 - 698849667","","ghanalorca@yahoo.es",""
"Archicofradía de Jesús Resucitado","Asociación Religiosa","483","G-30133748","Colegiata de San Patricio","30800","","","968 468 089","","",""
"Grupo Cultural de Cante y Baile Andaluz Chico","Asociación Cultural","484","G-73582868","Dip. Tercia, Camino de Baldazos","30815","","","","","","05/05/2005 0:00:00"
"Asociación Trovera Ciudad del Sol","Cultural y tradiciones populares","485","G-73335408","Dip. Tercia, Camino Baldazos","30815","","","600 584 854","","","05/05/2005 0:00:00"
"Asociación de Jóvenes de Campillo","Asociación de Jóvenes","486","G-30146112","Carretera de Almenara, 56 - A","30813","","","652 647 002","","","26/08/1986 0:00:00"
"Sociedad de Socorros Mútuos La Unión Obrera","Asociación con Fines Asistenciales","487","G-30099394","C/ Alcalde Pelegrín Rodríguez, 20","30800","","","600 072 113","","","20/12/1985 0:00:00"
"Asociación Peña La Jarapa","Cultural y tradiciones populares","489","G-73055477","C/ Charco","30800","","","868 927 094 ","","","04/11/2001 0:00:00"
"Asociación Comarcal de Empresarios de Ganadería y Agricultura de la Comarca del Guadalentín","Organizaciones Empresariales","490","G-73600744","C/ Abad de los Arcos, 3","30800","","","968 460 261","968 444 604                                       ","","15/04/2008 0:00:00"
"Asociación Patchwork","Asociación Cultural","498","G-73707093","Avda. Juan Carlos I, nº 58, Pl. 5, Pta. 1","30800","","","630655341","","","23/01/2012 0:00:00"
"Club Ciclista Juan Zurano","Asociación Deportiva","500","G-30531180","C/ Alameda Cervantes, nº 1","30800","","","666842301","","",""
"Asociación de Nigeria en Lorca","Asociación de Minorías Sociales","507","G-73796716","Plaza Saavedra, 2 - 2º E","30800","","","632 130 784 / 602 085 196","","","03/09/2012 0:00:00"
"Asociación Cultural Metal Lorca","Asociación Cultural","501","G-73772782","Alameda de Cervantes, Residencial Las Palmeras, nº 60, Esc I, Pl. 3º Pta. A","30800","","","","","","03/09/2012 0:00:00"
"Asociación GEAC","Organizaciones Profesionales","502","G-73768830","C/ Marco Alcázar (Diputación Cazalla), nº 9","30813","","","","","","24/09/2012 0:00:00"
"Asociación Cultural El Arte del Bordado en Lorca y su Puesta en Escena en sus Desfiles Bíblico Pasionales.","Cultural y tradiciones populares","508","G-73797755","C/ Presbítero Emilio García, 5 - 2º","30800","","","630 520 882","968 471 620                                       ","candidaturaunesco@lorca.es","15/11/2012 0:00:00"
"ASTRADE, Asociación para la Atención de Personas con Trastornos del Desarrollo de la Región de Murcia","Asociación con Fines Asistenciales","503","G-30508931","C/ Francisco Escobar Balberán, s/n","30800","","","968470996","968119100","astrade@astrade.es","27/05/1996 0:00:00"
"Asociación para Personas con Síndrome de Down de la Comarca de Lorca (DOWNLORCA)","Asociación de Discapacitados","509","G-73788382","Travesía Juan Carlos I, 12 - 5 - Bajo - K","30800","","","669 522 736","","downlorca@hotmail.com","22/02/2013 0:00:00"
"Asociación Huertos de tu Tierra - Ciudad del Sol ","Asociación de Defensa del Medioambiente.","504","G-73773285","Camino Pedazo de Afuera - La Hoya, P-29, B- 03","30816","","","630352945","","","03/11/2012 0:00:00"
"Asociación Fray Alonso de Vargas (AFAV)","Asociación Cultural","510","G-73801672","C/ Alonso de Vargas, s/n, Taberna La Luz","30800","","","","","","24/01/2013 0:00:00"
"Club Deportivo La Lagartija","Asociación Deportiva","505","G-73772378","C/ José Mouliáa, nº 31","30800","","","607623565","","juancar31@wanadoo.es","25/09/2012 0:00:00"
"Asociaciación de Vecinos del Barrio del Calvario","Asociación de Vecinos","511","G-30144646","C/ Cabezo de Vélez, 6","30800","","","696 244 931 / 687 388 580","","antoniolorca-@hotmail.com","26/06/1980 0:00:00"
"Asociación Cultural Amigos de las Sevillanas Tercia","Cultural y tradiciones populares","515","G-73571101","Camino Villaespesa Local Social","30815","","","656810731","","","08/01/2008 0:00:00"
"Asociación Patrimonio Musical y Amigos de la Música de Lorca","Asociación Cultural","512","G-73809337","Dip. Purias, Carretera de Aguilas, Km. 72, Panel 27- Buzón 8","30813","","","679 186 633","","","24/05/2013 0:00:00"
"Hermandad Nuestra Señora del Rocío de Lorca","Cultural y tradiciones populares","516","","C/ Nogalte, 33","30800","","","633793954","","","12/11/2013 0:00:00"
"Club de Rugby de Lorca","Asociación Deportiva","513","G-73672677","C/ Panadería, nº 3, Pl. 2, Pta. D","30800","","","","","clubderugbylorca@gmail.com","23/04/2010 0:00:00"
"Asociación Empresarios Minoristas de Venta en Plaza Abastos y Calles Adyacentes","Organizaciones Empresariales","517","G-73783128","C/ Abad de los Arcos, 3","30800","","","679 415 403","968 464 181                                       ","contacto@embutidos molina.com","16/12/1993 0:00:00"
"Asociación Nueva Vida de Totana","Asociación con Fines Asistenciales","518","G-73811051","C/ Ortega Melgares, 18 - 3º E","30800","","","632 728 074","","",""
"Club de Ajedrez Lorca","Asociación Deportiva","68","G-30346845","Alameda de la Constitucióin, s/n","30800","","","968 470 526","","",""
"Asociación Belenista de Lorca","Cultural y tradiciones populares","126","G-73008922","C/ Mazarróan, nº 2","30800","","","650 889 667","","belenistasdelorca@hotmail.com","01/11/1998 0:00:00"
"Asociación de Productores y Consumidores de Productos Naturales del Guadalentín","Organizaciones Profesionales","228","G-73291775","Avda. Juan Carlos I, 39","30800","","","","","","01/12/2003 0:00:00"
"Ayuda a los Niños de Bolivia","Asociación con Fines Asistenciales","290","G-73400913","C/ Los Guiraos, 15","30800","","","C/ Los Guiraos, 15","","","14/10/2005 0:00:00"
"FUNDACIÓN UNICEF. COMITE ESPAÑOL","Asociación de Cooperación Social","293","G-28382406","","","","","","","",""
"Federación Espartaria","Asociación Cultural","519","G-73832495","Dip. La Paca, Avda. Juan Carlos I, 5","30812","","","696 184 018 - 610039099","","","10/05/2013 0:00:00"
"San Francisco Lorca, C.D.","Asociación Deportiva","520","G73830051","C/ Obispo Alburquerque, nº 2 - 2º E","30800","","","669574142","901777423","administracion@sanfranciscolorcacd.com","01/02/2014 0:00:00"
"Asociación Amigos de la Cultura","Asociación Cultural","521","G30040752","C/ Poeta Gimeno Castellar, s/n","30800","","","","","info@amigosde la cultura.org","23/07/1979 0:00:00"
"Fotolorca Asociación Fotográrfica José Rodrigo de Lorca","Asociaciones de ocio","522","G-73831380","C/ Santa Paula, 9 - 4º B","30800","","","","968463252","","04/02/2014 0:00:00"
"Asociación Recreativa Fitness","Asociación Deportiva","523","G-73150174","C/ Fulgencio Martínez, 26","30812","","","630707035","","","11/04/2014 0:00:00"
"Asociación de Enfermedades Raras D'Genes","Sin Tipo","525","G-73567935","C/ Jerónimo Santa Fe, 9 - 1º B","30800","","","696141708","","info@dgenes.es","25/01/2008 0:00:00"
"Centro Islámico de Lorca Tawhid","Asociación Religiosa","524","g-73407819","C/ Juan de Toledo, 1 -1","30800","","","660460140","","","05/12/2005 0:00:00"
"MUJERES UNIDAS EN EL MUNDO APORTANDO AL DESARROLLO MHAM MUAD ONG","Asociación de Mujeres","526","G-73437360","C/ Cerro de la Muela, s/n. Polígono Los Peñones","30800","","","615 449 384","","","16/06/2014 0:00:00"
"Club de Pensionistas y Jubilados de Zarzadilla de Totana","Club de Pensionistas","527","G-73041824","C/ San Miguel, Zarzadilla de Totana (Centro Social)","30814","","","","","","12/05/1998 0:00:00"
"FEDERACIÓN DE PERSONAS SORDAS DE LA REGIÓN DE MURCIA (FESORMU)","Asociación de Discapacitados","528","G-30430516","C/ Travesía Benemérita, Bajo, 2","30800","","","968 220 475","","fesormu@fesormu.org","05/06/1994 0:00:00"
"Asociación Nuevos Lorquinos","Asociación con Fines Asistenciales","529","G-73713430","C/ José Mouliaa, 48","30800","","","692 066 946","","nuevoslorquinos@hotmail.com","07/06/2011 0:00:00"
"CLUB CICLOSENDERISTA EL GIGANTE","Asociación Deportiva","530","G-73641813","LA PARROQUIA, C/ FUENSANTA, 9","30811","","","666925353","","clubciclistaelgigante@gmail.com","01/06/2009 0:00:00"
"ASOCIACIÓN DE PADRES DE NIÑOS DEL CENTRO DE ATENCIÓN TEMPRANA DEL EXCMO. AYUNTAMIENTO DE LORCA","Asociación de Padres y Madres de Alumnos","531","G-30388045","C/ FRANCISCO ESCOBAR BARBERÁN, S/N. CASA DE LAS ONG´S","30800","","","662620589","","apatlorca2013@gmail.com","14/03/1986 0:00:00"
"CLUB DE ESGRIMA LORCA","Asociación Deportiva","532","G-73869182","C/ LOS NARANJOS, 6 - 2º D","30800","","","675326465","","clubesgrimalorca@gmail.com","17/11/2014 0:00:00"
"ASOCIACIÓN PARA EL DESARROLLO DE LAS TECNOLOGÍAS DE LA INFORMACIÓN Y LAS COMUNICACIONES","Asociación Cultural","533","G-73622945","C/ Abad de Los Arcos, nº3 - 3º","30800","","","968460261","","desarrollo@adetic.es","30/03/2009 0:00:00"
