nombre,tipoasociacion,numRegistro,cif,direccion,codpostal,longitud,latitud,telefono,fax,email,fconstitucion
"Asociación de Voluntariado Medioambiental de Lorca (VODEMA)","Asociación de Defensa del Medioambiente.","226","G-73013872","Carretera de Caravaca,  Camino Yeseros, nº 5","30800","","","968461784","","lorquina2002@yahoo.es","24/07/1998 0:00:00"
"Fundación 2001 - Global Nature","Asociación de Defensa del Medioambiente.","241","G-80707839","Corro del Postigo nº 1, Fuentes de Nava (Palencia)","34337","","","","","","23/07/1993 0:00:00"
"Grupo Naturalista para la Defensa del Medio Ambiente  -ARDEA-","Asociación de Defensa del Medioambiente.","106","G-73007221","Travesía Ramón y Cajal, 1","30800","","","907 66 21 33 - 929 99 29 66","","","20/07/1998 0:00:00"
"Taller de Iniciativas Socioculturales y Medioambientales (TISOM)","Asociación de Defensa del Medioambiente.","128","G-73039109","Avda. Juan Carlos I, nº 18 - 9º D","30800","","","968 472 908 y 617 597 452","","","24/05/1999 0:00:00"
"Asociación Huertos de tu Tierra - Ciudad del Sol ","Asociación de Defensa del Medioambiente.","504","G-73773285","Camino Pedazo de Afuera - La Hoya, P-29, B- 03","30816","","","630352945","","","03/11/2012 0:00:00"
