id,plazas,subgrupo,plaza,turno,acceso,urloferta
"398","10","-","ALUMNO/A ACTIVIDADES AUXILIARES DE COMERCIO - PROYECTO EMPLEO JOVEN LORCA","LIBRE","PRUEBAS SELECTIVAS","http://wwww.lorca.es/ficheros/file/oposiciones/apartados.asp?opo=398&id=464"
"399","10","-","ALUMNO/A ARREGLOS Y ADAPTACIONES DE PRENDAS Y ARTÍCULOS EN TEXTIL Y PIEL - PROYECTO EMPLEO JOVEN LORCA","LIBRE","PRUEBAS SELECTIVAS","http://wwww.lorca.es/ficheros/file/oposiciones/apartados.asp?opo=399&id=464"
"400","12","-","ALUMNO/A ATENCIÓN SOCIOSANITARIA A PERSONAS PEDENDIENTES EN INSTITUCIONES SOCIALES - PROYECTO EMPLEO JOVEN LORCA","LIBRE","PRUEBAS SELECTIVAS","http://wwww.lorca.es/ficheros/file/oposiciones/apartados.asp?opo=400&id=464"
"404","12","-","ALUMNO/A BORDADOS EN SEDA Y ORO - PROYECTO EMPLEO JOVEN LORCA","LIBRE","PRUEBAS SELECTIVAS","http://wwww.lorca.es/ficheros/file/oposiciones/apartados.asp?opo=404&id=464"
"403","10","-","ALUMNO/A CERRAJERÍA - PROYECTO EMPLEO JOVEN LORCA","LIBRE","PRUEBAS SELECTIVAS","http://wwww.lorca.es/ficheros/file/oposiciones/apartados.asp?opo=403&id=464"
"401","10","-","ALUMNO/A DINAMIZACIÓN ACTIVIDADES DE TIEMPO LIBRE EDUCATIVO, INFANTIL Y JUVENIL - PROYECTO EMPLEO JOVEN LORCA","LIBRE","PRUEBAS SELECTIVAS","http://wwww.lorca.es/ficheros/file/oposiciones/apartados.asp?opo=401&id=464"
"397","10","-","ALUMNO/A OPERACIONES AUXILIARES MONTAJE Y MANTENIMIENTO DE SISTEMAS MICROINFORMÁTICOS - PROYECTO EMPLEO JOVEN LORCA","LIBRE","PRUEBAS SELECTIVAS","http://wwww.lorca.es/ficheros/file/oposiciones/apartados.asp?opo=397&id=464"
"395","10","-","ALUMNO/A OPERACIONES BÁSICAS DE COCINA - PROYECTO EMPLEO JOVEN LORCA","LIBRE","PRUEBAS SELECTIVAS","http://wwww.lorca.es/ficheros/file/oposiciones/apartados.asp?opo=395&id=464"
"396","10","-","ALUMNO/A OPERACIONES BÁSICAS DE RESTAURANTE BAR - PROYECTO EMPLEO JOVEN LORCA","LIBRE","PRUEBAS SELECTIVAS","http://wwww.lorca.es/ficheros/file/oposiciones/apartados.asp?opo=396&id=464"
"402","10","-","ALUMNO/A PROMOCIÓN TURÍSTICA LOCAL E INFORMACIÓN AL VISITANTE - PROYECTO EMPLEO JOVEN LORCA","LIBRE","PRUEBAS SELECTIVAS","http://wwww.lorca.es/ficheros/file/oposiciones/apartados.asp?opo=402&id=464"
"382","7","-","BECA DE FORMACIÓN-COLABORACIÓN PRÁCTICA EN EL ÁMBITO DE LA RESTAURACIÓN DE MADERA ","LIBRE","PRUEBAS SELECTIVAS","http://wwww.lorca.es/ficheros/file/oposiciones/apartados.asp?opo=382&id=464"
"408","1","A2","DOCENTE DE INFORMÁTICA PARA PROYECTO EMPLEO JOVEN LORCA","LIBRE","PRUEBAS SELECTIVAS","http://wwww.lorca.es/ficheros/file/oposiciones/apartados.asp?opo=408&id=464"
"407","1","A2","DOCENTE DE INGLÉS PARA EL PROYECTO EMPLEO JOVEN LORCA","LIBRE","PRUEBAS SELECTIVAS","http://wwww.lorca.es/ficheros/file/oposiciones/apartados.asp?opo=407&id=464"
"379","1","C2","ELECTRICISTA (PERSONAL LABORAL FIJO)","LIBRE","OPOSICIÓN ","http://wwww.lorca.es/ficheros/file/oposiciones/apartados.asp?opo=379&id=464"
"380","1","A1","INGENIERO INDUSTRIAL ","LIBRE","OPOSICIÓN ","http://wwww.lorca.es/ficheros/file/oposiciones/apartados.asp?opo=380&id=464"
"384","2","A2","MAESTRO/A - PROYECTO EMPLEO JOVEN LORCA","LIBRE","PRUEBAS SELECTIVAS","http://wwww.lorca.es/ficheros/file/oposiciones/apartados.asp?opo=384&id=464"
"405","1","C1","MONITOR/A (2) ACCIÓN FORMATIVA DE BORDADOS - PROYECTO EMPLEO JOVEN LORCA  ","LIBRE","PRUEBAS SELECTIVAS","http://wwww.lorca.es/ficheros/file/oposiciones/apartados.asp?opo=405&id=464"
"385","1","C1","MONITOR/A ACCIÓN FORMATIVA DE BORDADOS - PROYECTO EMPLEO JOVEN LORCA ","LIBRE","PRUEBAS SELECTIVAS","http://wwww.lorca.es/ficheros/file/oposiciones/apartados.asp?opo=385&id=464"
"383","2","C1","MONITOR/A ACCIÓN FORMATIVA DE CERRAJERÍA - PROYECTO EMPLEO JOVEN LORCA ","LIBRE","PRUEBAS SELECTIVAS","http://wwww.lorca.es/ficheros/file/oposiciones/apartados.asp?opo=383&id=464"
"390","1","C1","MONITOR/A CERTIFICADOS PROFESIONALIDAD ACTIVIDADES DE COMERCIO - PROYECTO EMPLEO JOVEN LORCA","LIBRE","PRUEBAS SELECTIVAS","http://wwww.lorca.es/ficheros/file/oposiciones/apartados.asp?opo=390&id=464"
"391","1","C1","MONITOR/A CERTIFICADOS PROFESIONALIDAD ARREGLOS Y ADAPTACIONES DE PRENDAS Y ARTÍCULOS EN TEXTIL Y PIEL - PROYECTO EMPLEO JOVEN LORCA","LIBRE","PRUEBAS SELECTIVAS","http://wwww.lorca.es/ficheros/file/oposiciones/apartados.asp?opo=391&id=464"
"394","1","C1","MONITOR/A CERTIFICADOS PROFESIONALIDAD ATENCIÓN SOCIOSANITARIA A PERSONAS DEPENDIENTES EN INSTITUCIONES SOCIALES - PROYECTO EMPLEO JOVEN LORCA","LIBRE","PRUEBAS SELECTIVAS","http://wwww.lorca.es/ficheros/file/oposiciones/apartados.asp?opo=394&id=464"
"392","1","C1","MONITOR/A CERTIFICADOS PROFESIONALIDAD DINAMIZACIÓN DE ACTIVIDADES DE TIEMPO LIBRE EDUCATIVO, INFANTIL Y JUVENIL - PROYECTO EMPLEO JOVEN LORCA","LIBRE","PRUEBAS SELECTIVAS","http://wwww.lorca.es/ficheros/file/oposiciones/apartados.asp?opo=392&id=464"
"389","1","C1","MONITOR/A CERTIFICADOS PROFESIONALIDAD OPERACIONES AUXILIARES MONTAJE Y MANTENIMIENTO DE SISTEMAS MICROINFORMÁTICOS - PROYECTO EMPLEO JOVEN LORCA","LIBRE","PRUEBAS SELECTIVAS","http://wwww.lorca.es/ficheros/file/oposiciones/apartados.asp?opo=389&id=464"
"387","2","C1","MONITOR/A CERTIFICADOS PROFESIONALIDAD OPERACIONES BÁSICAS DE COCINA - PROYECTO EMPLEO JOVEN LORCA","LIBRE","PRUEBAS SELECTIVAS","http://wwww.lorca.es/ficheros/file/oposiciones/apartados.asp?opo=387&id=464"
"388","2","C1","MONITOR/A CERTIFICADOS PROFESIONALIDAD OPERACIONES BÁSICAS RESTAURANTE BAR - PROYECTO EMPLEO JOVEN LORCA","LIBRE","PRUEBAS SELECTIVAS","http://wwww.lorca.es/ficheros/file/oposiciones/apartados.asp?opo=388&id=464"
"393","1","C1","MONITOR/A CERTIFICADOS PROFESIONALIDAD PROMOCIÓN TURÍSTICA LOCAL E INFORMACIÓN AL VISITANTE - PROYECTO EMPLEO JOVEN LORCA","LIBRE","PRUEBAS SELECTIVAS","http://wwww.lorca.es/ficheros/file/oposiciones/apartados.asp?opo=393&id=464"
"406","1","C1","MONITOR/A DEL CURSO DE ESPECIALIZACIÓN EN EL CAMPO DE LA RESTAURACIÓN Y TALLA DE ELEMENTOS DE MADERA","LIBRE","PRUEBAS SELECTIVAS","http://wwww.lorca.es/ficheros/file/oposiciones/apartados.asp?opo=406&id=464"
"386","2","A2","TÉCNICO - PROYECTO EMPLEO JOVEN LORCA","LIBRE","PRUEBAS SELECTIVAS","http://wwww.lorca.es/ficheros/file/oposiciones/apartados.asp?opo=386&id=464"
"366","1","A1","TÉCNICO MEDIOAMBIENTAL ","LIBRE","CONCURSO-OPOSICIÓN ","http://wwww.lorca.es/ficheros/file/oposiciones/apartados.asp?opo=366&id=464"
