city,description,publisher,url,title,tag,date_extraction,frequency,formats,licenses,date_actualization,lenguage,date_creation,categories,geography
RUB,"Taula de requeriments de la policia local amb detall dels tipus d'intervenció, amb històric des de l'any 2010",dadesobertes,https://opendata.rubi.cat/views/24wk-jbuj.json,Intervencions de la policia municipal,"policia,seguretat,rubí,intervenció,requeriments,trànsit,assistència",2017/10/19_11:48:14,,,Creative Commons Attribution | No Derivative Works 3.0 Unported,2017/01/11_01:44:50,,2015/03/15_18:27:44,Policia,
RUB,"Taula dels tipus de moviments de la població de Rubí registrats al padró municipal, amb històric des de l'any 1996",dadesobertes,https://opendata.rubi.cat/views/bz2k-bahv.json,Població de Rubí_moviments del padró,"població,moviments,rubí,alta,canvi,domicili,baixa,renovació",2017/10/19_11:48:15,,,Creative Commons Attribution | No Derivative Works 3.0 Unported,2016/06/16_13:42:31,,2016/06/16_13:20:30,Padró Habitants,
RUB,Relació de comerços que representen els expedients d'activitats  del municipi,dadesobertes,https://opendata.rubi.cat/views/7nx9-3d4y.json,Activitats comercials,"activitats,comerç,esbarjo,salut,restauració,oficis,serveis,hotel,rubí",2017/10/19_11:48:15,,,Creative Commons Attribution | No Derivative Works 3.0 Unported,2017/10/18_01:50:36,,2014/11/28_12:57:48,Ciutat,
RUB,Relació d'expedients administratius interns (tipologia i descripció) tramitats per l'Ajuntament de Rubí,dadesobertes,https://opendata.rubi.cat/views/qjm9-wcrk.json,Expedients municipals,"expedients,rubí,tramitació,gestió,procediment,administratiu",2017/10/19_11:48:15,,,Creative Commons Attribution | No Derivative Works 3.0 Unported,2017/10/19_02:20:50,,2015/03/22_20:19:39,Tràmits i Gestions,
RUB,"Taula de dades electorals (europees, estatals, autonòmiques i municipals) amb el detall dels vots a partits i amb històric des de l'any 1976",dadesobertes,https://opendata.rubi.cat/views/k6t6-tu3a.json,Resultats electorals,"eleccions,municipals,autonòmiques,europees,rubí,congrés,senat,referèndum,partits",2017/10/19_11:48:15,,,Creative Commons Attribution | Noncommercial 3.0 Unported,2016/06/21_20:46:03,,2016/06/21_20:40:23,Eleccions,
RUB,Dades demogràfiques del municipi de Rubí corresponents a l'any en curs,dadesobertes,https://opendata.rubi.cat/views/48gr-gt5d.json,Població de Rubí_any actual,"població,llars,immigracio,rubí,demografia,procedència,estudis",2017/10/19_11:48:15,,,Creative Commons Attribution | No Derivative Works 3.0 Unported,2017/01/11_01:39:48,,2015/03/22_18:56:22,Padró Habitants,
RUB,"Conjunt de dades corresponents a les despeses pressupostàries en compres de béns corrents, serveis i inversions",dadesobertes,https://opendata.rubi.cat/views/qnp2-hje6.json,Obligacions reconegudes,"pressupost,obligacions,rubí,despeses,hisenda,finances,béns,corrents,serveis,inversions",2017/10/19_11:48:16,,,Creative Commons Attribution | Noncommercial 3.0 Unported,2017/10/18_12:31:05,,2016/02/22_09:28:56,Finances Municipals,
RUB,Taula de retribucions salarials de la plantilla de l'Ajuntament de Rubí corresponent a l'any 2014,dadesobertes,https://opendata.rubi.cat/views/fmfs-4e6x.json,Retribucions salarials de la plantilla municipal,"retribucions,plantilla,salaris,categoria,sou,rubí,jornada",2017/10/19_11:48:16,,,Creative Commons Attribution | No Derivative Works 3.0 Unported,2015/03/17_12:26:38,,2015/03/17_12:27:03,Recursos Humans,
RUB,Sol·licituds carpeta ciutadana,dadesobertes,https://opendata.rubi.cat/views/3xde-z62k.json,Sol·licituds carpeta ciutadana,tràmits,2017/10/19_11:48:16,,,Creative Commons Attribution | No Derivative Works 3.0 Unported,2017/10/13_02:15:29,,2015/03/21_13:03:17,Tràmits i Gestions,
RUB,"Taula amb els imports inicials del Pressupost municipal de despeses, amb històric des de l'any 2009",dadesobertes,https://opendata.rubi.cat/views/4esw-tbja.json,Pressupost municipal_Despeses inicials,"pressupost,finances,despeses,hisenda,economia,rubí",2017/10/19_11:48:16,,,Creative Commons Attribution | No Derivative Works 3.0 Unported,2016/02/10_11:48:32,,2015/03/11_13:55:47,Finances Municipals,
RUB,Subvencions que atorga l'Ajuntament de Rubí a persones jurídiques,dadesobertes,https://opendata.rubi.cat/views/7qkq-ua87.json,Subvencions municipals,"subvencions,finances,rubí,ajuts,economia,beneficiari,concessió",2017/10/19_11:48:17,,,Creative Commons Attribution | No Derivative Works 3.0 Unported,2017/10/19_02:35:45,,2015/05/28_14:13:28,Finances Municipals,
RUB,Taula que mostra l'estat actualitzat d'execució del pressupost vigent pel que fa a les despeses municipals,dadesobertes,https://opendata.rubi.cat/views/ynig-hhni.json,Pressupost municipal_Estat d'execució de despeses,"pressupost,finances,execució,hisenda,economia,rubí",2017/10/19_11:48:17,,,Creative Commons Attribution | No Derivative Works 3.0 Unported,2017/06/09_00:55:52,,2017/03/03_11:48:31,Finances Municipals,
RUB,"Taula amb dades electorals (europees, estatals, autonòmiques i municipals) amb resums del cens, avanços i total vots per mesa amb històric des de l'any 1976",dadesobertes,https://opendata.rubi.cat/views/8ubi-48d9.json,"Resultats electorals_resums cens, avanços i meses","eleccions,municipals,autonòmiques,europees,rubí,partits,cens",2017/10/19_11:48:17,,,Creative Commons Attribution | No Derivative Works 3.0 Unported,2016/06/21_20:21:11,,2014/11/28_12:55:38,Eleccions,
RUB,Taula que recull de forma actualitzada les modificacions que es van succeïnt en els pressupostos de despeses de l'any en curs,dadesobertes,https://opendata.rubi.cat/views/i7x4-rk4p.json,Pressupost municipal_Modificacions de despeses,"pressupost,modificacions,rubí,execució,despeses,hisenda,finances",2017/10/19_11:48:17,,,Creative Commons Attribution | No Derivative Works 3.0 Unported,2017/06/09_00:20:51,,2015/03/17_11:27:02,Finances Municipals,
RUB,"Taula amb valors demogràfics (edat, sexe, naixement, servei municipals) dels treballadors/es de la plantilla de l'Ajuntament",dadesobertes,https://opendata.rubi.cat/views/fe83-i8aj.json,Demografia de la plantilla municipal,"plantilla,rubí,edat,serveis,homes,dones,any,naixement",2017/10/19_11:48:18,,,Creative Commons 1.0 Universal (Public Domain Dedication),2017/10/19_01:45:31,,2015/03/12_12:28:50,Recursos Humans,
RUB,"Taula eleccions resum cens, avanços i total vots per mesa",dadesobertes,https://opendata.rubi.cat/views/y3ka-755q.json,API Eleccions totals mesa,,2017/10/19_11:48:18,,,Creative Commons Attribution | No Derivative Works 3.0 Unported,2016/06/21_20:21:11,,2014/11/28_12:55:38,Eleccions,
RUB,Mapa Zones escolars,dadesobertes,https://opendata.rubi.cat/views/an28-aqe9.json,Mapa Zones escolars,escoles,2017/10/19_11:48:18,,,Creative Commons Attribution | No Derivative Works 3.0 Unported,,,2015/03/16_12:15:47,Ciutat,
RUB,,dadesobertes,https://opendata.rubi.cat/views/4tkq-6svm.json,Districtes Censals,"districtes,eleccions",2017/10/19_11:48:18,,,Creative Commons Attribution | No Derivative Works 3.0 Unported,,,2015/02/25_13:47:31,Eleccions,
RUB,"Taula amb les dades bàsiques dels accidents de trànsit, amb històric des del 2012",dadesobertes,https://opendata.rubi.cat/views/a6bd-zs3p.json,Accidents de trànsit,"accidents,policia,seguretat,rubí",2017/10/19_11:48:18,,,Creative Commons Attribution | No Derivative Works 3.0 Unported,2017/10/17_02:25:29,,2015/03/20_14:00:36,Policia,
RUB,Escrutini dels resultats electorals,dadesobertes,https://opendata.rubi.cat/views/g4nb-ty97.json,Eleccions escrutini,"eleccions,escrutini,rubí,resultats",2017/10/19_11:48:19,,,Creative Commons Attribution | No Derivative Works 3.0 Unported,2016/10/12_23:23:53,,2015/07/29_11:47:23,Eleccions,
RUB,Mapa Seccions Censals,dadesobertes,https://opendata.rubi.cat/views/79sn-b79m.json,Mapa Seccions Censals,seccions,2017/10/19_11:48:19,,,Creative Commons 1.0 Universal (Public Domain Dedication),,,2014/08/19_11:35:47,Ciutat,
RUB,"Taula amb els imports inicials del Pressupost municipal d'ingressos, amb històric des de l'any 2009",dadesobertes,https://opendata.rubi.cat/views/gzmv-fkyu.json,Pressupost municipal_Ingressos inicials,"pressupost,finances,ingressos,hisenda,economia,rubí",2017/10/19_11:48:19,,,Creative Commons Attribution | No Derivative Works 3.0 Unported,2016/02/15_14:02:56,,2015/05/22_17:20:41,Finances Municipals,
RUB,,dadesobertes,https://opendata.rubi.cat/views/f9ix-c3dd.json,Manual De Uso - Catalan,,2017/10/19_11:48:19,,,,,,2015/03/06_13:46:29,,
RUB,"Conjunt de dades corresponents a les despeses pressupostàries en compres de béns corrents, serveis i inversions",dadesobertes,https://opendata.rubi.cat/views/vct4-tkiu.json,Publicitat Institucional,"pressupost,obligacions,rubí,despeses,hisenda,finances,béns,corrents,serveis,inversions",2017/10/19_11:48:20,,,Creative Commons Attribution | Noncommercial 3.0 Unported,2017/10/18_12:31:05,,2016/02/22_09:28:56,Finances Municipals,
RUB,Relació actualitzada de les denominacions dels diferents tipus de vies del municipi i els seus codis corresponents,dadesobertes,https://opendata.rubi.cat/views/giwn-x6k2.json,Carrerer municipal,"carrerer,carrers,rubí,ubicació,localització",2017/10/19_11:48:20,,,Creative Commons Attribution | No Derivative Works 3.0 Unported,2017/10/19_01:55:31,,2015/03/12_12:30:22,Ciutat,
RUB,Filtre eleccions total vots a partits per convocatòria,dadesobertes,https://opendata.rubi.cat/views/7mz6-6fwc.json,Eleccions total vots a partits per convocatòria,,2017/10/19_11:48:20,,,Creative Commons Attribution | Noncommercial 3.0 Unported,2016/06/21_20:46:03,,2016/06/21_20:40:23,Eleccions,
RUB,,dadesobertes,https://opendata.rubi.cat/views/msj5-m8bf.json,Registre D' Entitats Ciutadanes,entitats,2017/10/19_11:48:20,,,Creative Commons Attribution | No Derivative Works 3.0 Unported,2016/12/23_10:25:30,,2016/12/23_10:29:20,Ciutat,
RUB,Filtre eleccions total vots a partits per convocatòria,dadesobertes,https://opendata.rubi.cat/views/vr4g-wyiv.json,"Eleccions comparativa (PSC,ERC,ICV,PP)",,2017/10/19_11:48:21,,,Creative Commons Attribution | Noncommercial 3.0 Unported,2016/06/21_20:46:03,,2016/06/21_20:40:23,Eleccions,
RUB,,dadesobertes,https://opendata.rubi.cat/views/ggta-amia.json,Cens D'animals,"animals,cens",2017/10/19_11:48:21,,,Creative Commons Attribution | Noncommercial 3.0 Unported,2016/07/15_11:09:08,,2016/07/15_11:13:39,Ciutat,
RUB,Mapa Equipaments,dadesobertes,https://opendata.rubi.cat/views/4mmz-esuj.json,Mapa Equipaments,equipaments,2017/10/19_11:48:21,,,Creative Commons Attribution | No Derivative Works 3.0 Unported,,,2015/03/16_11:53:17,Ciutat,
RUB,Taula que mostra l'estat actualitzat d'execució del pressupost vigent pel que fa als ingressos municipals,dadesobertes,https://opendata.rubi.cat/views/ds9h-xggj.json,Pressupost municipal_Estat d'execució d'ingressos,"pressupost,finances,execució,hisenda,economia,rubí,ingressos",2017/10/19_11:48:22,,,Creative Commons 1.0 Universal (Public Domain Dedication),2017/06/09_00:45:47,,2015/03/12_12:25:10,Finances Municipals,
RUB,Relació de contractes menors,dadesobertes,https://opendata.rubi.cat/views/h8jg-hf37.json,Contractes menors,contractes menors,2017/10/19_11:48:22,,,Creative Commons Attribution | No Derivative Works 3.0 Unported,2017/10/19_00:11:17,,2016/12/22_08:03:34,Finances Municipals,
RUB,Evolució dels vots de CIU a la secció censal 4 del districte 4. A totes les eleccions de la democràcia,dadesobertes,https://opendata.rubi.cat/views/va59-8rzz.json,_Evolució vots CIU a la secció 4-4,"eleccions,ciu,seccions censals",2017/10/19_11:48:22,,,Creative Commons Attribution | Noncommercial 3.0 Unported,2016/06/21_20:46:03,,2016/06/21_20:40:23,Eleccions,
RUB,Taula que recull de forma actualitzada les modificacions que es van succeïnt en els pressupostos d'ingressos de l'any en curs,dadesobertes,https://opendata.rubi.cat/views/33kc-wcts.json,Pressupost municipal_Modificacions d'ingressos,"pressupost,modificacions,rubí,execució,ingressos,hisenda,finances",2017/10/19_11:48:22,,,Creative Commons Attribution | No Derivative Works 3.0 Unported,2017/06/13_00:05:48,,2014/11/28_13:32:36,Finances Municipals,
RUB,Mapa polígons CiT,dadesobertes,https://opendata.rubi.cat/views/w82n-x5xb.json,Mapa polígons CiT,polígons,2017/10/19_11:48:23,,,Creative Commons Attribution | No Derivative Works 3.0 Unported,,,2015/03/16_12:03:28,Ciutat,
RUB,Eleccions Escrutini,dadesobertes,https://opendata.rubi.cat/views/xs3s-kbp9.json,meses-vots-2011-2,"eleccions,escrutini",2017/10/19_11:48:23,,,Creative Commons Attribution | No Derivative Works 3.0 Unported,2016/10/12_23:23:53,,2015/07/29_11:47:23,Eleccions,
RUB,,Dylan Bussone,https://opendata.rubi.cat/views/ty8j-2trj.json,Pàgines,,2017/10/19_11:48:23,,,,2015/03/16_12:51:37,,2015/03/16_12:51:40,,
RUB,Mapa Linies de bus,dadesobertes,https://opendata.rubi.cat/views/nze2-223j.json,Mapa Linies de bus,bus,2017/10/19_11:48:23,,,Creative Commons Attribution | No Derivative Works 3.0 Unported,,,2015/03/16_11:59:40,Ciutat,
RUB,Filtre eleccions total vots a partits (Europees 2014),dadesobertes,https://opendata.rubi.cat/views/pzmc-66p7.json,Eleccions vots a partis (Europees 2014),,2017/10/19_11:48:24,,,Creative Commons Attribution | Noncommercial 3.0 Unported,2016/06/21_20:46:03,,2016/06/21_20:40:23,Eleccions,
RUB,,dadesobertes,https://opendata.rubi.cat/views/8d9s-q6r2.json,Mapes Soroll NIT,"mapa,soroll",2017/10/19_11:48:24,,,Creative Commons Attribution | No Derivative Works 3.0 Unported,,,2015/03/23_22:50:20,Ciutat,
RUB,Mapa itineraris a peu,dadesobertes,https://opendata.rubi.cat/views/sh4h-urf5.json,Mapa itineraris a peu,itineraris,2017/10/19_11:48:24,,,Creative Commons Attribution | No Derivative Works 3.0 Unported,,,2015/03/16_11:55:07,Ciutat,
RUB,Taula eleccions vots a partits Històric,dadesobertes,https://opendata.rubi.cat/views/cqi3-yj7b.json,meses-vots-2011,,2017/10/19_11:48:24,,,Creative Commons Attribution | Noncommercial 3.0 Unported,2016/06/21_20:46:03,,2016/06/21_20:40:23,Eleccions,
RUB,Taula eleccions vots a partits Històric,dadesobertes,https://opendata.rubi.cat/views/j9zx-a3jt.json,Vots Municipals 2011 per partits,,2017/10/19_11:48:24,,,Creative Commons Attribution | Noncommercial 3.0 Unported,2016/06/21_20:46:03,,2016/06/21_20:40:23,Eleccions,
RUB,Taula eleccions vots a partits Històric,dadesobertes,https://opendata.rubi.cat/views/scq6-2fwp.json,app_historic_meses,,2017/10/19_11:48:25,,,Creative Commons Attribution | Noncommercial 3.0 Unported,2016/06/21_20:46:03,,2016/06/21_20:40:23,Eleccions,
RUB,APIde arcgis pel mapa del carrerer de Rubí,dadesobertes,https://opendata.rubi.cat/views/fcw2-3gh8.json,API arcgis Mapa del carrerer de Rubí,,2017/10/19_11:48:25,,,Creative Commons 1.0 Universal (Public Domain Dedication),,,2014/08/07_11:29:19,Ciutat,
RUB,Taula eleccions vots a partits,dadesobertes,https://opendata.rubi.cat/views/wdgr-dc93.json,vots per partit,,2017/10/19_11:48:25,,,Creative Commons Attribution | Noncommercial 3.0 Unported,2016/06/21_20:46:03,,2016/06/21_20:40:23,Eleccions,
RUB,,dadesobertes,https://opendata.rubi.cat/views/ijps-ndw6.json,Mapes Soroll DIA,"mapa,soroll",2017/10/19_11:48:26,,,Creative Commons Attribution | No Derivative Works 3.0 Unported,,,2015/03/23_22:53:43,Ciutat,
RUB,Mapa Àrees bàsiques de salut,dadesobertes,https://opendata.rubi.cat/views/4ska-rzp2.json,Mapa Àrees bàsiques de salut,salut,2017/10/19_11:48:26,,,Creative Commons Attribution | No Derivative Works 3.0 Unported,,,2015/03/16_11:46:53,Ciutat,
RUB,Taula eleccions vots a partits,dadesobertes,https://opendata.rubi.cat/views/7vif-uh3g.json,evolucio psc,,2017/10/19_11:48:26,,,Creative Commons Attribution | Noncommercial 3.0 Unported,2016/06/21_20:46:03,,2016/06/21_20:40:23,Eleccions,
RUB,Catàleg de tràmits,dadesobertes,https://opendata.rubi.cat/views/bpcu-wwqr.json,Catàleg de tràmits,tràmits,2017/10/19_11:48:26,,,Creative Commons Attribution | No Derivative Works 3.0 Unported,2017/10/05_02:01:01,,2015/03/17_14:34:31,Tràmits i Gestions,
RUB,Mapa Zones d'esbarjo de gossos,dadesobertes,https://opendata.rubi.cat/views/krd5-p7hp.json,Mapa Zones d'esbarjo de gossos,gossos,2017/10/19_11:48:27,,,Creative Commons Attribution | No Derivative Works 3.0 Unported,,,2015/03/16_12:04:32,Ciutat,
RUB,"Filtre eleccions resum per cens, avanços i total vots  per convocatòria",dadesobertes,https://opendata.rubi.cat/views/itsy-i9cc.json,"Eleccions total cens, avanços i vots per convocatòria",,2017/10/19_11:48:27,,,Creative Commons Attribution | No Derivative Works 3.0 Unported,2016/06/21_20:21:11,,2014/11/28_12:55:38,Eleccions,
RUB,Eleccions Escrutini (Test),dadesobertes,https://opendata.rubi.cat/views/ag8k-imch.json,partits-vots-2011-2,"eleccions,escrutini",2017/10/19_11:48:27,,,Creative Commons Attribution | No Derivative Works 3.0 Unported,2016/10/12_23:23:53,,2015/07/29_11:47:23,Eleccions,
RUB,Taula eleccions vots a partits Històric,dadesobertes,https://opendata.rubi.cat/views/m6n8-3ddq.json,2011_total_vots,,2017/10/19_11:48:27,,,Creative Commons Attribution | Noncommercial 3.0 Unported,2016/06/21_20:46:03,,2016/06/21_20:40:23,Eleccions,
RUB,Filtre eleccions total cens per convocatòria,dadesobertes,https://opendata.rubi.cat/views/8d8h-9g6n.json,Eleccions total cens per convocatòria,,2017/10/19_11:48:28,,,Creative Commons Attribution | No Derivative Works 3.0 Unported,2016/06/21_20:21:11,,2014/11/28_12:55:38,Eleccions,
RUB,Taula eleccions vots a partits Històric,dadesobertes,https://opendata.rubi.cat/views/evzx-qs8f.json,partiti-vots-2011,,2017/10/19_11:48:28,,,Creative Commons Attribution | Noncommercial 3.0 Unported,2016/06/21_20:46:03,,2016/06/21_20:40:23,Eleccions,
RUB,"Conjunt de dades corresponents a les despeses pressupostàries en compres de béns corrents, serveis i inversions",dadesobertes,https://opendata.rubi.cat/views/4mbh-ziw3.json,Despeses en protocol 2016,"pressupost,obligacions,rubí,despeses,hisenda,finances,béns,corrents,serveis,inversions",2017/10/19_11:48:28,,,Creative Commons Attribution | Noncommercial 3.0 Unported,2017/10/18_12:31:05,,2016/02/22_09:28:56,Finances Municipals,
RUB,Taula eleccions vots a partits Històric,dadesobertes,https://opendata.rubi.cat/views/xkm3-gtwu.json,app_historic,,2017/10/19_11:48:29,,,Creative Commons Attribution | Noncommercial 3.0 Unported,2016/06/21_20:46:03,,2016/06/21_20:40:23,Eleccions,
RUB,,dadesobertes,https://opendata.rubi.cat/views/vy4g-rtm6.json,Manual De Uso - Castellano,,2017/10/19_11:48:29,,,,,,2015/03/06_13:44:36,,
RUB,"Conjunt de dades corresponents a les despeses pressupostàries en compres de béns corrents, serveis i inversions",dadesobertes,https://opendata.rubi.cat/views/f4sd-7e89.json,Despeses en protocol 2015,"pressupost,obligacions,rubí,despeses,hisenda,finances,béns,corrents,serveis,inversions",2017/10/19_11:48:29,,,Creative Commons Attribution | Noncommercial 3.0 Unported,2017/10/18_12:31:05,,2016/02/22_09:28:56,Finances Municipals,
RUB,,dadesobertes,https://opendata.rubi.cat/views/74q4-66fy.json,CONDICIONS D'US,,2017/10/19_11:48:29,,,,,,2014/11/10_22:54:41,,
RUB,,dadesobertes,https://opendata.rubi.cat/views/phmz-n35z.json,Open Data Rubií - CONDICIONES DE USO,,2017/10/19_11:48:30,,,,,,2014/11/10_22:47:09,,
RUB,,dadesobertes,https://opendata.rubi.cat/views/yfke-62ak.json,Open Data Rubi - Terms Of Use,,2017/10/19_11:48:30,,,,,,2014/11/10_22:36:39,,
