url,identificador,locale,send,foto,nombre,telefono,fax,correo-electronico,web,horario,descripcion,direccion,localizacion,categorias
"http://www.gijon.es/directorios/show/3280-albergue-de-peregrinos-camping-municipal-de-deva","3280","es","fecha-actualizacion2014-09-01 12:50:49 +0200","http://www.gijon.es/data/images/f0/f2/28712/169x127_v1_46962_1131132010182336.jpg","Albergue de Peregrinos Camping Municipal de Deva","985 133 848","985 133 889","info@campingdeva-gijon.com","http://www.campingdeva-gijon.com","El Alojamiento de Peregrinos de Gijón se encuentra ubicado en el <a href="http://turismo.gijon.es/directorios/show/3223-camping-municipal-de-deva" title="Ir a http://turismo.gijon.es/directorios/show/3223-camping-municipal-de-deva" rel="external">Camping Municipal de Deva</a> y se rige por las <a href="http://tematico.asturias.es/caminodesantiago/" title="Ir a http://tematico.asturias.es/caminodesantiago/" rel="external">Normas de Uso de Albergues de Peregrinos del Principado de Asturias</a>.<br/><br/>Las cabañas son de madera de estilo provenzal, bonitas y acogedoras, junto una arboleda y amplia zona de recreo y una terraza para disfrutar. Con capacidad máxima de 6 personas. Además, los usuarios del alojamiento de peregrinos puedes disfrutar de todos los servicios del Camping:<br/><br/><ul><li>3 grandes bloques de baños, en los que hay aseos, duchas, lavaderos, fregaderos, baño adaptado a minusválidos.</li><li>Amplias zonas comunes. Zona de esparcimiento de 16.000 metros cuadrados. Cafetería self-service, restaurante asador, salón social, ludoteca, supermercado, ciber, área recreativa, barbacoas, parque infantil, cabinas de teléfono, lavandería, custodia de valores, pista de tenis, cancha de baloncesto, futbito, campo de fútbol, piscina de adultos y niños.</li><li>Merendero Deva con entrada libre.</li></ul><h3>Normas de utilización de las cabañas de peregrinos:</h3><br/><ul><li>Pueden utilizarse por todas las personas que acudan en peregrinación a Santiago de Compostela, ó, que regresen a la finalización de la misma, siempre que se acrediten mediante la Credencial del Peregrino ó Compostela, sellada en los lugares de procedencia y paso del Camino de Santiago. - Las plazas se ocuparán según el orden de llegada de los peregrinos, sin que, en ningún caso, se puedan realizar reservas de ningún tipo.</li><li>El orden de preferencia en la ocupación será el siguiente: Primero, los peregrinos que viajen a pie ó con limitaciones físicas, después los que viajen en bicicleta, los que viajen a caballo y, por último, los que vayan en coche de apoyo.</li><li>La estancia será de una sola noche, salvo causa de fuerza mayor.</li><li>Se deberá acceder al recinto antes de las 22 horas y desalojarlo antes de las 10 h del día siguiente.</li><li>La utilización del albergue es gratuita, colaborando el peregrino con aportaciones económicas voluntarias para la financiación del mantenimiento de las instalaciones.</li></ul><br/><br/><h3>Distancia kilométrica de los siguientes equipamientos</h3><br/><table><tbody><tr><td>Cajero automático <br/></td><td>A 2 km. (en el Hospital de Cabueñes)<br/></td></tr><tr><td>Tienda de alimentación<br/></td><td>En el mismo camping<br/></td></tr><tr><td>Restaurante</td><td>En el mismo camping<br/></td></tr><tr><td>Centro de salud<br/></td><td>A 2 km. (en el Hospital de Cabueñes)<br/></td></tr></tbody></table>","Camín de la Pasadiella 85, Carretera Nacional 632, Punto Kilométrico 64. 33394 Gijón","43.513069 -5.598071","Sin clasificar, Albergues de peregrinos, Alojamiento, Alojamientos, Sin clasificar, Albergues de peregrinos, Turismo, Gijón con Calidad"
"http://www.gijon.es/directorios/show/1788-residencia-cultural-y-universitaria-de-cimadevilla","1788","es","fecha-actualizacion2014-01-22 12:03:08 +0100","http://www.gijon.es/data/images/f7/7305/127x107_v1_DirectorioHotelResidenciaCimadevilla.jpg","Residencia cultural y universitaria de Cimadevilla","984 198 504","984 198 761","rucimadevilla@telecable.es","Residencia de estudiantes 1 septiembre al 30 de junio","Plaza de la Colegiata, s/n","43.54583 -5.663278","Alojamientos"
"http://www.gijon.es/directorios/show/1777-apartamentos-san-esteban-dos-llaves","1777","es","fecha-actualizacion2014-09-01 13:33:33 +0200","http://www.gijon.es/data/images/f0/f2/26848/169x112_v1_blue.jpg","Apartamentos San Esteban Dos llaves","985 090 929","985 092 010","apartamentossanesteban@bluehoteles.es","Edificio de nueva construcción, en pleno centro de Gijón, a un paso de la Playa San Lorenzo y totalmente equipados. Categoría: Dos llaves.Nº de plazas: 60.Nº apartamentos y plazas: 4 estudios de 2 pax,8 apartamentos de 2-4 pax (habitación doble y sofá cama en salón),8 apartamentos de 4-6 pax (2 habitaciones dobles y sofá cama en salón). Empresa certificada 2005 Sistema de Calidad Turística en Destino (SICTED).","C/Cabrales, 17","Alojamientos, 2010, Gijón, Turismo, Gijón con Calidad"
"http://www.gijon.es/directorios/show/1152-pension-pinole","1152","es","fecha-actualizacion2014-01-22 12:02:50 +0100","Pensión Piñole*","984 190 249 , 678 288 275","Categoría: *","C/Covadonga, 25 - 1º","43.538364 -5.663197","Alojamientos"
"http://www.gijon.es/directorios/show/1141-pension-casa-vazquez","1141","es","fecha-actualizacion2014-01-22 12:02:50 +0100","Pensión Casa Vázquez*","985 361 936","Categoría: *Nº Plazas: 4.","C/Premio Real, 18 - 8ºE","43.54005 -5.652415","Alojamientos"
"http://www.gijon.es/directorios/show/805-pension-verde-mar","805","es","fecha-actualizacion2014-01-22 12:02:42 +0100","http://www.gijon.es/data/images/f6/6688/162x283_v1_DirectoriopensionesVerdeMar.JPG","Pensión Verde Mar**","985 354 980","985 354 980","bmoran@telecable.es","Categoría: **Nº Plazas: 18.Dispone de: Canal Satélite e Internet (gratuito),   todas las habitaciones con baño, calefacción, T.V y  por cada 8 estancias 1 gratis.","C/Adaro, 4 - 1º","Alojamientos"
"http://www.gijon.es/directorios/show/788-gran-hotel-jovellanos","788","es","fecha-actualizacion2014-01-22 12:02:42 +0100","http://www.gijon.es/data/images/f6/6674/250x155_v1_DirectorioHotelGranHotelJovellanos.jpg","Gran Hotel Jovellanos****","902 525 000","985 010 750","granhoteljovellanos@granhoteljovellanos.net; info@granhoteljovellanos.net","Situado a 5 km de Gijon, con las mejores comunicaciones y aparcamiento vigilado para coches y autocares. En él destaca la tranquilidad, amplitud y funcionalidad. Las instalaciones ideales para el descanso y las reuniones profesionales. Categoría: ****Nº de plazas: 288.Número de habitaciones: 144 habitaciones. Servicios en habitaciones: Teléfono en habitación con baño y toallero caliente. Servicios en hotel: 4 suites con jacuzzi, patio interior para coktails y Gimnasio completo.Asociado a: Unión Hotelera del Principado de Asturias.Empresa certificada 2005 Sistema de Calidad Turística en Destino (SICTED).Club de empresas de la Oficina de Congresos de Gijón.","C/Galileo Galilei, s/n. (Porceyo)","43.499227 -5.7011","Alojamientos, Turismo"
"http://www.gijon.es/directorios/show/406-albergue-de-los-remedios-u-hospital-de-los-corraxos","406","es","fecha-actualizacion2014-01-22 12:02:29 +0100","http://www.gijon.es/data/images/f6/6397/285x214_v1_DirectorioMONUMENTOShospitalperegrinos01.JPG","Albergue de los Remedios u Hospital de los Corraxos","Edificio donde está el restaurante Casa Zabala. Antiguo hospital de peregrinos (calles Remedios y Vizconde del Campo), integrado en la misma manzana que el Museo Casa Natal de Jovellanos y la contigua capilla de los Remedios ¿antaño pertenencia de este establecimiento benéfico¿. Se trata de un edificio del XVII, aunque con bastantes reformas fechadas en los siglos XVIII y XIX. Rendueles-Llanos, historiador local, asegura que era anterior al XVII, momento en el que, al parecer, cambió su primitivo nombre de hospital de peregrinos por el de los Remedios. Desempeñó las funciones de hospital hasta el año 1836.","C/Los Remedios, 2","43.545943 -5.662996","Monumentos, Alojamientos, 2010, Gijón"
"http://www.gijon.es/directorios/show/286-atalanta-centro-educativo-psicopedagogico","286","es","fecha-actualizacion2016-02-12 09:37:08 +0100","http://www.gijon.es/data/images/f6/6345/250x254_v1_DirectorioludotecasLudotecaAtalanta.jpg","Atalanta.Centro Educativo Psicopedagógico","984 397 622","info@e-atalanta.com","Lunes a Viernes: 16:00-21:00h. Sábados: 10:00-14:00h. (Verano)Lunes a Viernes: 8:00-14:00h.","Atalanta es unespacio abierto a la creatividad y la imaginación, desde el que se potenciantodas las <strong>habilidadesdel niño</strong>, no sólo a nivel educativo, también afectivo,académico y social. Talleres educativos y servicio de guardería en períodovacacional. Actividades según edad: <strong>de 3 a 6 y de 6 a 12 años</strong>.<p></p>imaginación, desde el que se potencian todas las <strong>habilidades del niño</strong>,no sólo a nivel educativo, también afectivo, académico y social. Tallereseducativos y servicio de guardería en período vacacional. Actividades segúnedad: <strong>de 3 a6 y de 6 a 12 años</strong>.<br/><br/>   ","C/Langreo, 12","43.540529 -5.665453","Ludotecas, Alojamientos, 2010, Gijón, Agua, Información Juvenil, mujer, Mayores, Inmigrante, Infantil, Deporte, Gobierno, Hacienda, Universidad Popular, Llingua y cultura asturiana, Seguridad ciudadana, Solidario, Gijón en el mundo, Festejos, Vivienda, Bus, Cuidado ambiental, Servicios Sociales, Empleo, Tarjeta ciudadana, Gijón verde, FETEN, Gijón Orienta, Intranet, Elecciones, Sede electrónica, Museos, Bibliotecas, Turismo, Teatro Jovellanos, Cultura y Ocio, Turismo"
"http://www.gijon.es/directorios/show/265-albergue-covadonga","265","es","fecha-actualizacion2014-01-22 12:02:25 +0100","http://www.gijon.es/data/images/f6/6334/286x120_v1_DirectorioalberguesCovadonga1.JPG","Albergue Covadonga","985 358 434","985 319 031","info@alberguecovadonga.com"," ","C/Diario el Comercio, s/n.","43.53852 -5.673848","Servicios Municipales, 2010, Gijón, Alojamientos, Albergue"
