url,identificador,locale,send,foto,nombre,telefono,fax,correo-electronico,web,horario,descripcion,direccion,localizacion,categorias
"http://www.gijon.es/directorios/show/9844-real-sporting-gijon-business-club","9844","es","fecha-actualizacion2017-07-12 14:11:33 +0200","http://www.gijon.es/data/images/f0/f6/62232/410x315_v1_sala_de_prensa_Molinon2.jpg","Real Sporting Gijón Business Club","984 28 29 36","985 16 76 32","tourmolinon@dtaocioyturismo.com","http://www.realsporting.com/","Celebra tus eventos en un entorno totalmente diferente en Asturias.<br/> <br/> El Molinón ofrece múltiples posibilidades de combinaciones de servicios, espacios y experiencias.<br/> <br/> Un entorno y espacios singulares para la celebración de reuniones de empresa, almuerzos de trabajo, presentaciones de producto, actividades motivacionales y de Team Building, visitas privadas, rodajes y filmaciones y mucho más.<br/>","Luis Adaro s/n 33203 Gijón","43.536178 -5.637274","Recintos singulares, Campos de Fútbol, Club de Empresas de Turismo de Negocios, Deporte"
"http://www.gijon.es/directorios/show/1870-campo-de-futbol-la-llosa","1870","es","fecha-actualizacion2014-01-22 12:03:09 +0100","Campo de Fútbol la Llosa","Club deportivo  Montevil  651 72 27 59","C/Irene Fernandez Perera s/n Junto C. Guarcia Civil 33211","43.519634 -5.66751","2010, Gijón, Campos de Fútbol"
"http://www.gijon.es/directorios/show/1402-campos-de-futbol-c-d-universidad-laboral","1402","es","fecha-actualizacion2014-01-22 12:02:56 +0100","http://www.gijon.es/data/images/f0/f4/45788/436x327_v1_c.duniversidadlaboral.jpg","Campos de Fútbol | C.D Universidad Laboral","985 181 728","mantenimiento.pdm@gijon.es","http://deporte.gijon.es/page/11509-complejo-deportivo-universidad-laboral","<a title="Ir a Horarios de apertura de las instalaciones deportivas" href="http://deporte.gijon.es/page/11880-horarios-de-apertura-de-las-instalaciones-deportivas" rel="external">Horarios generales de las IDM<br/></a>","<ul><li>El C. D. Universidad Laboral cuenta con un campos de fútbol reglamentario de hierba natural.</li><li>Medidas: 102 X 67 m</li></ul><p>+ Info</p><p><br/></p><p><br/></p><p><a href="http://deporte.gijon.es/page/11509-complejo-deportivo-universidad-laboral" title="Ir a complejo deportivo universidad laboral">C. D. Universidad Labora</a><a href="http://deporte.gijon.es/page/95-pagina-de-inicio" title="Ir a página de inicio">l</a></p>","Campos de Fútbol Universidad Laboral - Ctra. N-632 km. 67, 200 - <p>C/ Jose Luis Álvarez Margaride, s/n 1459. </p><p><strong>Coordenadas:</strong> N 5º 37' 15 -W 43º 31' 30''</p>","43.522259 -5.615129","Campos de Fútbol, 2010, Gijón, Deporte"
"http://www.gijon.es/directorios/show/608-estadio-el-molinon","608","es","fecha-actualizacion2014-05-12 14:50:22 +0200","http://www.gijon.es/data/images/f6/6530/297x253_v1_DirectorioinstalacionesdeportivasEstadioElMolinon.jpg","Estadio El Molinón","985 167 677","Medidas del terreno de juego: 105 x 70 metros. Real Sporting de Gijón S.A.D.","Avda. de El Molinón","43.536268 -5.637403","Campos de Fútbol, 2010, Gijón, Deporte"
"http://www.gijon.es/directorios/show/596-escuela-de-futbol-de-mareo","596","es","fecha-actualizacion2014-01-22 12:02:35 +0100","http://www.gijon.es/data/images/f6/6524/250x336_v1_Directorioinstalacionesdeportivasfutbol-mareo.jpg","Escuela de Fútbol de Mareo","985 160 505 , 985 167 677","Escuela de Mareo s/n - Mareo s/n<br/>","43.49715 -5.682058","Campos de Fútbol, Otros Espacios Deportivos, 2010, Gijón"
"http://www.gijon.es/directorios/show/381-campo-de-futbol-covadonga","381","es","fecha-actualizacion2014-01-22 12:02:28 +0100","Campo de Fútbol Covadonga","985 161 064","Gestiona por el C.D. Roces.","C/Velazquez, s/n.","43.519427 -5.67564","Campos de Fútbol, 2010, Gijón"
"http://www.gijon.es/directorios/show/380-campo-de-futbol-los-pericones","380","es","fecha-actualizacion2014-01-22 12:02:28 +0100","Campo de Fútbol Los Pericones","985 161 448","985 161 448","Gestiona por el C.D. Manuel Rubio.Persona de contacto:José Manuel Álvarez Junquera.","C/Pepe Ortiz, 21","43.527432 -5.652702","Campos de Fútbol, 2010, Gijón"
"http://www.gijon.es/directorios/show/379-campo-de-futbol-montevil","379","es","fecha-actualizacion2014-01-22 12:02:28 +0100","Campo de Fútbol Montevil","985 152 715","Gestiona por Montevil C.F.","C/Irene Fernández Perera, s/n.","43.517054 -5.667288","Campos de Fútbol, 2010, Gijón"
"http://www.gijon.es/directorios/show/378-campo-de-futbol-de-lloreda","378","es","fecha-actualizacion2014-01-22 12:02:28 +0100","Campo de Fútbol de Lloreda","985 311 213","Gestiona por la A.D. Lloreda.","C/Marruecos, s/n. (Tremañes)","43.527615 -5.70986","Campos de Fútbol, 2010, Gijón"
"http://www.gijon.es/directorios/show/377-campo-de-futbol-la-cruz","377","es","fecha-actualizacion2014-01-22 12:02:28 +0100","Campo de Fútbol La Cruz","985 152 244","Gestionado por la Unión Ceares Gijones.","Ctra. de Ceares. La Tejerona","43.529276 -5.655491","Campos de Fútbol, 2010, Gijón"
"http://www.gijon.es/directorios/show/376-campo-de-futbol-la-camocha","376","es","fecha-actualizacion2014-01-22 12:02:28 +0100","Campo de Fútbol La Camocha","637 455 576 ,  985 095 620","Gestiona po el Club Deportivo Atletico Camocha.Persona de contacto: José Alarcón Gil.","Capor de Fútbol La Camocha - La Camocha","43.488183 -5.648056","Campos de Fútbol, 2010, Gijón"
"http://www.gijon.es/directorios/show/375-campo-de-futbol-el-mortero","375","es","fecha-actualizacion2014-01-22 12:02:28 +0100","http://www.gijon.es/data/images/f6/6384/200x130_v1_DirectorioinstalacionesdeportivasElmortero2.jpg","Campo de Fútbol El Mortero","605 677 199 ,  985 152 333","Gestiona por el Club Deportivo La Braña.Persona de contacto: José Antonio Meana Montes.","Bº Sta. Bárbara. Junto al comienzo de la Via Verde de La Camocha.","43.520003 -5.691041","Campos de Fútbol, 2010, Gijón"
"http://www.gijon.es/directorios/show/374-campo-de-futbol-el-tragamon","374","es","fecha-actualizacion2014-01-22 12:02:28 +0100","Campo de Fútbol El Tragamón","985 133 855 , 985 335 339","985 133 855","Gestiona Club Deportivo El Arenal.Persona de contacto: Victor Manuel Martínez Fernández.","Cefontes - El Tragamón - Castiello de Bernueces","43.518213 -5.626309","2010, Gijón, Campos de Fútbol"
