url,identificador,locale,send,foto,nombre,telefono,fax,correo-electronico,web,horario,descripcion,direccion,localizacion,categorias
"http://www.gijon.es/directorios/show/9549-complejo-deportivo-de-moreda-natahoyo","9549","es","fecha-actualizacion2014-01-22 12:06:26 +0100","http://www.gijon.es/data/images/f0/f4/45640/556x417_v1_complejodeportivomoresa.jpg","Complejo Deportivo de Moreda - Natahoyo","985 181 418","m@gijon.es","http://deporte.gijon.es/page/95-pagina-de-inicio","<a title="Ir a Horarios de apertura de las instalaciones deportivas" href="http://deporte.gijon.es/page/11880-horarios-de-apertura-de-las-instalaciones-deportivas" rel="external">Horarios generales de IDM</a>","Complejo Deportivo insaugurado el 1/5/2002 que cuenta con un pabellón, un patinódromo, una piscina climatizada y sala de musculación.<br/><br/><p style="FONT-WEIGHT: bold">+ Info:</p><ul><li><a title="Ir a precios públicos del pdm" href="http://deporte.gijon.es/page/11897-precios-publicos-del-pdm">Precios públicos del PDM</a> </li><li><a title="Ir a normativa y aforos de las instalaciones deportivas municipales" href="http://deporte.gijon.es/page/11898-normativa-y-aforos-de-las-instalaciones-deportivas-municipales">Normativa aplicable y aforos</a></li></ul>","<p>Avda. Juan Carlos I s/n. <br/></p><p><strong>Coordenadas:</strong> W 5º 41' 09'' - N 43º 32' 11''</p>","Complejos Deportivos, Deporte, 2012, Gijón, Deporte"
"http://www.gijon.es/directorios/show/332-complejo-deportivo-universidad-laboral","332","es","fecha-actualizacion2016-06-09 09:06:36 +0200","http://www.gijon.es/data/images/f0/f4/45788/436x327_v1_c.duniversidadlaboral.jpg","Complejo Deportivo Universidad Laboral","985 181 729","m@gijon.es","http://deporte.gijon.es/page/95-pagina-de-inicio","<a title="Ir a Horarios de apertura de las instalaciones deportivas" href="http://deporte.gijon.es/page/11880-horarios-de-apertura-de-las-instalaciones-deportivas" rel="external">Horarios generales de IDM</a>","Complejo deportivo inaugurado el 01/02/2002 y que cuenta con las siguientes instalaciones deportivas:<br/><ul><li>1 campos de fútbol de hierba natural con iluminación artificial. </li><li>1 campo de beisbol de hierba natural con iluminación artificial. </li><li>1 campo de hockey hierba sintética con iluminación artificial. </li><li>1 campo de rugby de hierba natural con iluminación artificial. </li><li>1 pista de atletismo.</li></ul><p style="TEXT-ALIGN: center"><img class="nicedit_sin-alinear" alt="general" src="/data/images/f0/f4/45792/650x143_v1_c.universidalaboral.jpg" height="143" width="650" width="650" height="143"/><br/></p>","<p>C/ Jose Luis Álvarez Margaride, s/n 1459. </p><p><strong>Coordenadas:</strong> W 5º 37' 15''- N 43º 31' 30''</p>","43.52231 -5.615247","Complejos Deportivos, Gijón, Deporte, Deporte"
"http://www.gijon.es/directorios/show/331-complejo-deportivo-pumarin-gijon-sur","331","es","fecha-actualizacion2014-01-22 12:02:27 +0100","http://www.gijon.es/data/images/f6/6421/250x188_v1_DirectorioedificiosmunicipalesCMI-gijonsur.jpg","Complejo Deportivo Pumarín "Gijón Sur"","985 181 654","m@gijon.es","http://deporte.gijon.es/page/95-pagina-de-inicio","<a title="Ir a Horarios de apertura de las instalaciones deportivas" href="http://deporte.gijon.es/page/11880-horarios-de-apertura-de-las-instalaciones-deportivas" rel="external">Horarios Generales de IDM</a>","<ul><li>Complejo Deportivo integrado en el Centro Municipal Integrado Gijón Sur, inaugurado el 31-07-2002 </li><li>Dotado con las siguientes instalaciones: un pabellón, una piscina climatizada, dos pistas de squash, una sala de musculación y una sauna.</li></ul><h4><b>Descuento del 40% con la tarjeta turística Gijón Card</b></h4><p><span style="FONT-WEIGHT: bold">+ Info:</span><br/></p><ul><li><a title="Ir a precios públicos del pdm" href="http://deporte.gijon.es/page/11897-precios-publicos-del-pdm">Precios públicos del PDM</a> </li><li><a title="Ir a normativa y aforos de las instalaciones deportivas municipales" href="http://deporte.gijon.es/page/11898-normativa-y-aforos-de-las-instalaciones-deportivas-municipales">Normativa aplicable y aforos</a></li></ul><p><img class="nicedit_sin-alinear" alt="Pabellon gijon sur" src="/data/images/f0/f4/45768/640x141_v1_GSRPabellon640x141.jpg" width="640" height="141" width="640" height="141"/><br/></p>","<p>C/Ramón Areces, 7. </p><p><strong>Coordenadas:</strong> W 5º 40' 41''- N 43º 31' 29''</p>","43.524842 -5.678161","Complejos Deportivos, Gijón, Deporte, 2012, Deporte, Gijón card. Tarjeta turística, Gijón Card"
"http://www.gijon.es/directorios/show/329-complejo-deportivo-las-mestas","329","es","fecha-actualizacion2014-06-09 15:35:24 +0200","http://www.gijon.es/data/images/f0/f4/47124/250x187_v1_DSCF1622250x187.jpg","Complejo Deportivo Las Mestas"," 985 181 758 ( Pista de Atletismo); 985 181 026/029 (<a title="Ir a http://hipico.gijon.es/private/80-prsuarez/page/11043-contacto" href="http://hipico.gijon.es/page/11043-contacto" rel="external">Concurso Hípico</a>,  Telf. operativo durante el concurso)","m@gijon.es","http://deporte.gijon.es/page/95-pagina-de-inicio","<a title="Ir a Horarios de apertura de las instalaciones deportivas" href="http://deporte.gijon.es/page/11880-horarios-de-apertura-de-las-instalaciones-deportivas" rel="external">Horarios generales de las IDM</a>","Fecha de inauguración : 1/1/1986<br/>El Complejo Deportivo cuenta con dos zonas claramente diferenciadas:<br/><span style="FONT-WEIGHT: bold"><br/></span><div style="TEXT-ALIGN: justify"><span style="FONT-WEIGHT: bold">Zona Sur: </span><span style="TEXT-DECORATION: underline">Estadio de Atletismo Jose Luis Rubio</span> instalación dotada con pista de atletismo homolaga según la normativa de la Real Federación Española, un módulo cubierto de atletismo y una sala de musculación. Además cuenta con una grada para albergar a 3.000 espectadores.<br/><span style="FONT-WEIGHT: bold"></span><br/></div><p style="TEXT-ALIGN: center"><img class="nicedit_sin-alinear" alt="las mestas" src="/data/images/f0/f4/48555/652x295_v1_CROSS50652x295.jpg" height="295" width="652" width="652" height="295"/><span style="FONT-WEIGHT: bold"><br/></span></p><p style="TEXT-ALIGN: justify"><span style="FONT-WEIGHT: bold">Zona Norte: </span>donde se encuentra ubicado un campo de rugby, un campo de fútbol americano, una pista de saltos hípicos<span style="TEXT-DECORATION: underline"></span>, un velódromo, un anillo acuático, dos pistas pistas polideportiva, una sala de musculación, una pista de hípico de entrenamiento de arena, tres naves de boxes para alojar caballos, así como una zona de aparcamientos.  <br/></p><p style="TEXT-ALIGN: justify">Recinto donde no solo se puede disfrutar del <a style="FONT-WEIGHT: bold" title="Ir a http://hipico.gijon.es/" href="http://hipico.gijon.es/" rel="external">concurso hípico</a> cada verano sino que durante todo el año es lugar de encuentro y competición para ciclistas, patinadores, jugadores de rugby y palistas, entre otros. En ocasiones es también escenario de conciertos multitudinarios ya que tiene la capacidad de albergar 15.000 personas. Instalación dotada con dos tribunas con 3.000 localidades con asiento. <br/></p><p style="TEXT-ALIGN: justify">Durante los días de Concurso se instalan en Las Mestas distintos servicios de hostelería, con varias zonas de cafetería, cervecería y restauración, incluido un restaurante panorámico situado a pie de pista, dos completas zona de ocio infantil gratuitas que incluyen juegos hinchables, ludoteca para los más pequeños y pony-park a la que se añaden zonas de stands comerciales y exposición. (<span style="FONT-WEIGHT: bold">+ información en <a title="Ir a http://hipico.gijon.es/" href="http://hipico.gijon.es/" rel="external">hipico.gijon.es</a></span>).</p><p style="TEXT-ALIGN: justify"><br/></p><p style="TEXT-ALIGN: center"><img class="nicedit_sin-alinear" alt="pista de saltos" src="/data/images/f0/f4/48227/712x230_v1_juegosdesiempre.jpg" height="230" width="712" width="712" height="230"/><br/></p><h3>Accesos:</h3><ul><li><span style="FONT-WEIGHT: bold">Acceso peatonal y de vehiculos a la zona Sur </span>( Estadio de Atletismo Jose Luis Rubio) por Paseo Arqueólogo M. Fernández-Miranda Fernández<span style="FONT-WEIGHT: bold">. Coordenadas: </span>W 5º 38' 22,08''- N 43º 31' 42,26''</li><li><span style="FONT-WEIGHT: bold">Acceso peatonal y de vehiculos autorizados a la zona Norte</span> ( campo de rugby, pista de saltos, velódromo ...) por C/ Jesús Revuelta. <span style="FONT-WEIGHT: bold">Coordenadas:</span> W 5º 38' 22,08'' - N 43º 31' 42,26'' N</li><li><span style="FONT-WEIGHT: bold">Acceso de vehículos a las zonas de boxes</span> por C/ Albert Einstein. Coordenadas: W 5º 38' 15,97''-  N43º 31'' 41,29''</li></ul>","Avda. Jesús Revuelta s/n.<br/><span style="FONT-WEIGHT: bold">Coordenadas:</span> W 5º 38' 09''- N 43º 31' 57''.","43.530089 -5.639605","Complejos Deportivos, Gijón, Deporte, Hípico, Deporte"
"http://www.gijon.es/directorios/show/326-complejo-deportivo-la-calzada","326","es","fecha-actualizacion2014-01-22 12:02:27 +0100","http://www.gijon.es/data/images/f0/f4/42490/253x189_v1_lacalzada.jpg","Complejo Deportivo La Calzada","985 181 415","m@gijon.es","/page/6910-contacto","<a title="Ir a Horarios de apertura de las instalaciones deportivas" href="http://deporte.gijon.es/page/11880-horarios-de-apertura-de-las-instalaciones-deportivas" rel="external">Horarios generales de las IDM</a>","Complejo Deportivo insaugurado el 1/5/2002 que cuenta con pistas de tenis, pistas de padel, sauna y piscina climatizada.<br/><span style="FONT-WEIGHT: bold">+ Info:</span><br/><ul><li><a title="Ir a Precios Públicos del PDM" href="http://deporte.gijon.es/page/11897-precios-publicos-del-pdm" rel="external">Precios públicos del PDM</a> </li><li><a title="Ir a Normativa y aforos de las Instalaciones Deportivas Municipales" href="http://deporte.gijon.es/page/11898-normativa-y-aforos-de-las-instalaciones-deportivas-municipales" rel="external">Normativa aplicable y aforos</a></li></ul>","<p>C/Simón Bolivar, s/n.</p><p><strong>Coordenadas:</strong> W 5º 41' 09''- N 43º 32' 09''</p>","43.535981 -5.699549","Complejos Deportivos, Gijón, Deporte, 2012, Deporte"
"http://www.gijon.es/directorios/show/325-complejo-deportivo-el-llano-contrueces","325","es","fecha-actualizacion2014-01-22 12:02:27 +0100","http://www.gijon.es/data/images/f0/f4/48439/200x136_v1_Llano.jpg","Complejo Deportivo El Llano - Contrueces","985 181 417","m@gijon.es","/page/6910-contacto","<a title="Ir a Horarios de apertura de las instalaciones deportivas" href="http://deporte.gijon.es/page/11880-horarios-de-apertura-de-las-instalaciones-deportivas" rel="external">Horarios generales de IDM</a>","Complejo deportivo inauguradoel 01/03/1994 dotado con un pabellón, cuatro pistas de tenis, dos pistas de pádel y un frontón.<br/><br/><span style="FONT-WEIGHT: bold">+ Info:</span><br/><ul><li><a title="Ir a precios públicos del pdm" href="http://deporte.gijon.es/page/11897-precios-publicos-del-pdm">Precios públicos del PDM</a> </li><li><a title="Ir a normativa y aforos de las instalaciones deportivas municipales" href="http://deporte.gijon.es/page/11898-normativa-y-aforos-de-las-instalaciones-deportivas-municipales">Normativa aplicable y aforos</a></li></ul>","Avda. de El Llano, 71.<br style="FONT-WEIGHT: bold"/><span style="FONT-WEIGHT: bold">Coordenadas:</span> W 5º 39' 44''- N 43º 31' 34''","43.525939 -5.662336","Complejos Deportivos, Gijón, Deporte, Deporte"
"http://www.gijon.es/directorios/show/10-centro-municipal-integrado-de-gijon-sur","10","es","fecha-actualizacion2017-07-12 09:58:07 +0200","http://www.gijon.es/data/images/f2/2545/250x188_v1_CMI-gijonsur.jpg","Centro Municipal Integrado de Gijón-Sur","+ 34 985 181 640","<strong></strong>+ 34 985 181 639","cmigijonsur@gijon.es","http://www.gijon.es","Lunes a sábados: 8:00 a 22:00 horas. Domingos de 8:00 a 15:00 horas.","<p style="text-align: justify;">El nacimiento de este centro integrado supuso dotar a la zona Sur de un conjunto de equipamientos que demandaba por su gran crecimiento urbanístico y rejuvenecimiento demográfico. Su arquitectura demuestra a las claras la noción de integración, pues comparte, en el mismo edificio, usos administrativos, deportivos (con pabellón y piscina) y socioculturales, en un gran complejo cívico que es ya una referencia para el barrio y, en algunos servicios, para toda la ciudad. Nuevamente la idea de coordinar y acercar a cualquier residencia todos los servicios descentralizados por el ayuntamiento, visibles en una destacada arquitectura</p><p style="text-align: justify;">Dispone de: oficina de atención a la ciudadanía, concejalía de distrito, Servicios Sociales, biblioteca, Mediateca (12 puestos), sala de estudio (60 puestos), salón de actos, aulas, salas polivalentes, sala de exposiciones, pabellón deportivo, piscina, sauna, gimnasio, canchas de squash y cajero ciudadano</p><p style="text-align: justify;" align="center"><img src="/data/images/f0/f4/42494/640x407_v1_GijonSurteatro.JPG" alt="suteatro" class="nicedit_sin-alinear magnify" height="407" width="640" width="640" height="407"/><br/></p><p><b><a href="http://issuu.com/agendasdeloscentrosintegrados/docs/red_de_centros_municipales_integrad" title="Ir a http://issuu.com/agendasdeloscentrosintegrados/docs/red_de_centros_municipales_integrad" rel="external">Espacios del Centro Municipal Integrado Gijón-Sur (ver espacios).</a></b><br/></p><div style="text-align: center;"><br/></div><table><thead><tr><th style="text-align: center;">Espacio<br/></th><th style="text-align: center;">Puestos y aforo<br/></th></tr></thead><tbody><tr><td>Salón de actos<br/></td><td style="text-align: right;">350</td></tr><tr><td>Aulas 1 a 5<br/></td><td style="text-align: right;">20</td></tr><tr><td>Aula 6/7<br/></td><td style="text-align: right;">70<br/></td></tr><tr><td>Sala de estudio<br/></td><td style="text-align: right;">60<br/></td></tr><tr><td>Biblioteca<br/></td><td style="text-align: right;">Adultos: 25<br/>Infantil: 25<br/>Lectura de prensa: 32<br/></td></tr><tr><td>Mediateca<br/></td><td style="text-align: right;">12<br/></td></tr><tr><td style="vertical-align: top;">Sala de exposiciones<br/></td><td style="vertical-align: top; text-align: right;">180 m2<br/></td></tr><tr><td>Piscina<br/></td><td style="text-align: right;">Vaso grande: 104 usuarios máximo.<br/>Vaso pequeño: 25 usuarios máximo.<br/>No hay graderío.<br/></td></tr><tr><td>Polideportivo<br/></td><td style="text-align: right;">Grada: 300.<br/>Pista: en caso de eventos en pista hasta 700.<br/></td></tr><tr><td style="vertical-align: top;">Gimnasio<br/></td><td style="vertical-align: top; text-align: right;">26<br/></td></tr><tr><td style="vertical-align: top;">Sauna<br/></td><td style="vertical-align: top; text-align: right;">4<br/></td></tr><tr><td style="vertical-align: top;">Canchas de Squash<br/></td><td style="vertical-align: top; text-align: right;">4 (2 pistas)<br/></td></tr></tbody></table>","C/ Ramón Areces, 7. 33211 Gijón","43.524769 -5.678161","Edificios Municipales, Cajeros Ciudadanos, Servicio Atención a la Ciudadanía, Servicios Municipales, Servicios Sociales, Bibliotecas, Teatro, Sala de Exposiciones, Complejos Deportivos, Pabellones, Piscinas Municipales, Pistas Polideportivas, Servicios municipales, Centros culturales, Zona Wifi, Otras salas de congresos, Administración, Comunicaciones, Cultura y Ocio, Deporte, Turismo"
